"OrderId","LineId","Id","Quantity","ItemId","SubCode","ItemYahooAucId","ItemYahooAucMerchantId","Title","ItemOptionName","ItemOptionValue","ItemOptionPrice","SubCodeOption","InscriptionName","InscriptionValue","UnitPrice","PriceType","UnitGetPoint","LineSubTotal","LineGetPoint","PointFspCode","Condition","CouponId","CouponDiscount","OriginalPrice","IsGetPointFix","GetPointFixDate","ReleaseDate","GetPointType","Jan","ProductId","LineGetPointChargedToStore","LeadTimeStart","LeadTimeEnd","LeadTimeText","ItemTaxRatio","UnitGetStoreBonus","LineGetBonus","IsGetStoreBonusFix","GetStoreBonusFixDate","LineGetBonusChargedToStore"
"10000851","1","froufroumarket-10000851","1","M6156","","l1094796148","","美品/23区 ニット アンサンブル 表記 38号 9号 M 相当 黒 ブラック レディース 春 夏 秋 冬 長袖 半袖 毛混 ウール ラメ カーディガン 丸首","","","","","","","7920","1","0","7920","0","","1","","","","0","","","","","1451","0","2024/10/27","2024/10/27","翌日発送（休業日を除く）","10","0","0","0","未確定","0"
"10000850","1","froufroumarket-10000850","1","AUCTIONh1051673195","","h1051673195","A1982","A美品/HILFIGER DENIM ヒルフィガーデニム ジップアップニットジャケット 小さいサイズ XSサイズ(5号/32号相当)カシミヤ混 グレー 秋冬向け","","","","","","","6210","1","0","6210","0","","1","","","","0","","","","","-1","0","","","発送日情報なし","10","0","0","0","未確定","0"
"10000849","1","froufroumarket-10000849","1","AUCTIONq1097387700","","q1097387700","","美品/アニエスベー ADRIEN BEAU agnes b スラックスパンツ フランス製 表記 38号 9号 相当 グレー 羊毛 ウール 秋冬 ボトムス レディース","","","","","","","13200","1","0","13200","0","","1","","","","0","","","","","40707","0","2024/10/24","2024/10/24","翌日発送（休業日を除く）","10","0","0","0","未確定","0"
"10000848","1","froufroumarket-10000848","1","AUCTIONg1051561029","","g1051561029","A3723","Ａ美品/バーバリー BURBERRYS お洒落セットアップ イタリア製生地 小さいサイズ 表記9号(7号相当) 緑/グリーン チェック柄 春夏 レディース","","","","","","","24900","1","0","24900","0","","1","","","","0","","","","","-1","0","","","発送日情報なし","10","0","0","0","未確定","0"
"10000847","1","froufroumarket-10000847","1","A4883","","","","美品/プラステ PLST セオリー ニットワンピース 表記 M 9号 相当 紺 ネイビー Vネック シンプル 無地 オフィス お出掛け 春秋 レディース","","","","","","","14520","1","0","14520","0","","1","","","","0","2024/10/22","","","","","0","2024/10/25","2024/10/25","","10","132","132","1","2024-10-21","132"
"10000846","1","froufroumarket-10000846","1","AUCTIONj1051576580","","j1051576580","M3682","M美品/シャミー Chamois 羽織系ニットカーディガン 表記F(9号/11号/大きいサイズ13号相当) 黒 7分袖 刺繍 毛100% 秋冬 トップス レディース","","","","","","","12800","1","0","12800","0","","1","","","","0","","","","","-1","0","","","発送日情報なし","10","0","0","0","未確定","0"
"10000845","1","froufroumarket-10000845","1","AUCTIONq1051237258","","q1051237258","A2487","A新品同様/ ギャルリーヴィー GALERIE VIE 爽やかなブラウス (9号/M相当) 青/ブルー ピンストライプ柄 春夏秋向け トップス レディース","","","","","","","5500","1","0","5500","0","","1","","","","0","","","","","-1","0","","","発送日情報なし","10","0","0","0","未確定","0"
"10000844","1","froufroumarket-10000844","1","AUCTION1051567514","","1051567514","M1101","M美*ザラZARA KNIT♪紺白*フード裏ボア*ざっくり暖ニットベストM","","","","","","","5300","1","0","5300","0","","1","","","","0","","","","","-1","0","","","発送日情報なし","10","0","0","0","未確定","0"
"10000843","1","froufroumarket-10000843","1","AUCTIONv1051226746","","v1051226746","H144","H美品/Pierre cardin ピエールカルダン 美彩ふっくらニットコート 表記M(9~11号相当) 紫 ウール混 秋冬向け チェック アウター レディース","","","","","","","24900","1","0","24900","0","","1","","","","0","","","","","-1","0","","","発送日情報なし","10","0","0","0","未確定","0"
"10000842","1","froufroumarket-10000842","1","M5852","","m1081815074","","美品/レリアン Leilian シャツブラウス ジャケット 表記11号 L相当 古着 オフホワイト 白系 レディース 薄手 春夏 トップス 7分袖 ゆったり","","","","","","","22000","1","0","22000","0","","1","","","","0","","","","","28222","0","2024/10/06","2024/10/06","翌日発送（休業日を除く）","10","0","0","0","未確定","0"
"10000841","1","froufroumarket-10000841","1","M5040","","o496138364","","新品同様/イギン BILL BLASS シフォン素材ワンピース 大きいサイズ 表記15号(3L相当) 黒/ブラック ロング丈 袖フリル 春夏向け レディース","","","","","","","23100","1","0","23100","0","","1","","","","0","","","","","44093","0","2024/10/06","2024/10/06","翌日発送（休業日を除く）","10","0","0","0","未確定","0"
"10000840","1","froufroumarket-10000840","1","M7036","","n1140597079","","新品同様/トゥーシー TWO:C ワンピース 表記 40号 11号 L 相当 古着 黒 ブラック レディース 春 夏 半袖 膝丈 ひざ丈 ノーカラー シンプル","","","","","","","11000","1","0","11000","0","","1","","","","0","","","","","44841","0","2024/10/06","2024/10/06","翌日発送（休業日を除く）","10","0","0","0","未確定","0"
"10000839","1","froufroumarket-10000839","1","A5567","","","","美品/ヤッコマリカルド YACCO MARICARD チュニック 大きい 表記 N 13号 15号 相当 緑 グリーン ピンタック 春 秋 トップス レディース","","","","","","","19030","1","0","19030","0","","1","","","","0","2024/10/02","","","","","0","2024/10/01","2024/10/01","翌日発送（休業日を除く）","10","173","173","1","2024-10-01","173"
"10000839","2","froufroumarket-10000839","1","A5547","","","","美品/ヤッコマリカルド YACCO MARICARD コットンブラウス 11号 13号 相当 黒 ブラック 綿 ボーダー柄 おしゃれ 春 夏 トップス レディース","","","","","","","18480","1","0","18480","0","","1","","","","0","2024/10/02","","","","","0","2024/10/01","2024/10/01","翌日発送（休業日を除く）","10","168","168","1","2024-10-01","168"
"10000838","1","froufroumarket-10000838","1","M7062","","h1142002104","","美品/ガウディ GAUDI スキニーパンツ 小さいサイズ 表記 28号 S 相当 黒 ブラック レディース 春 夏 ボトムス 綿混 コットン ストレッチ","","","","","","","7920","1","0","7920","0","","1","","","","0","","","","","40747","0","2024/10/01","2024/10/01","翌日発送（休業日を除く）","10","0","0","0","未確定","0"
"10000837","1","froufroumarket-10000837","1","AUCTIONx1051606375","","x1051606375","S64","S美品 ザラ ZARA お洒落美脚ロングパンツ 11号/Lサイズ 白×黒 チェック柄 ボトムス レディース ","","","","","","","2995","1","0","2995","0","","1","","","","0","","","","","-1","0","","","発送日情報なし","10","0","0","0","未確定","0"
"10000836","1","froufroumarket-10000836","1","pm","","","","レキシオ 特製プレイマット 韓国 ボードゲーム 牌ボードゲーム 麻雀 ポーカー 大富豪 Lexio レキシオネオ LexioNeo アナログゲーム 送料無料 パーティー 2〜5人","","","","","","","4980","1","0","4980","0","","0","","","","0","","","","","","0","2024/09/30","2024/09/30","翌日発送（休業日を除く）","10","0","0","0","未確定","0"
"10000835","1","froufroumarket-10000835","1","AUCTIONs1051456673","","s1051456673","6446","美品/グレースコンチネンタル GRACE CONTINENTAL 輝きパールジャケット 小さい 表記36号(７号相当) ベージュ 春秋向け アウター レディース","","","","","","","30000","1","0","30000","0","","1","","","","0","","","","","-1","0","","","発送日情報なし","10","0","0","0","未確定","0"
"10000834","1","froufroumarket-10000834","1","AUCTIONj1051238246","","j1051238246","6611","美品/ヨシエイナバ L'EQUIPE YOSHIE INABA チェック柄フレアスカート 表記9号(Mサイズ相当) 緑/グリーン 春夏向け ボトムス レディース","","","","","","","5500","1","0","5500","0","","1","","","","0","","","","","-1","0","","","発送日情報なし","10","0","0","0","未確定","0"
"10000833","1","froufroumarket-10000833","1","M4780","","t793827390","","美品/ピエールバルマン PIERRE BALMAIN 異素材ジャケット 表記B/F/E42号(大きい13号相当) 黒/ブラック ベロア 秋冬向 アウター レディース","","","","","","","16830","1","0","16830","0","","1","","","","0","","","","","28254","0","2024/09/29","2024/09/29","翌日発送（休業日を除く）","10","0","0","0","未確定","0"
"10000832","1","froufroumarket-10000832","1","A5281","","","","美品/ロベルタ ディ カメリーノ Roberta di Camerin ニットワンピース 表記 9号 38号 相当 茶 ブラウン ロゴ お出掛け 春 秋 レディース","","","","","","","20130","1","0","20130","0","","1","","","","0","2024/10/02","","","","","0","2024/09/26","2024/09/26","翌日発送（休業日を除く）","10","183","183","1","2024-10-01","183"
"10000831","1","froufroumarket-10000831","1","M6940","","f1135576513","","美品/シビラ Sybilla カーディガン 小さいサイズ 表記 SS 5号 相当 ベージュ レディース 春 夏 トップス Vネック レース 綿100 コットン","","","","","","","8690","1","0","8690","0","","1","","","","0","","","","","4859","0","2024/09/26","2024/09/26","翌日発送（休業日を除く）","10","0","0","0","未確定","0"
"10000830","1","froufroumarket-10000830","1","A4568","","x1083727453","","美品/ビースリー B3 ストレッチパンツ 小さい 表記 30号 7号 相当 黒 ブラック 伸縮性 無地 ロゴ釦 お出掛け 春夏秋 ボトムス レディース","","","","","","","6600","1","0","6600","0","","1","","","","0","","","","","40749","0","2024/09/24","2024/09/24","翌日発送（休業日を除く）","10","0","0","0","未確定","0"
"10000829","1","froufroumarket-10000829","1","M7111","","","","美品/レリアン Leilian カーディガン 大きいサイズ 表記 13号 LL 相当 黒 ブラック レディース 春 秋冬 トップス 長袖 絹 シルク 毛 ウール","","","","","","","14520","1","0","14520","0","","1","","","","0","2024/10/02","","","","","0","2024/09/27","2024/09/27","","10","132","132","1","2024-10-01","132"
"10000828","1","froufroumarket-10000828","1","AUCTIONr1051619262","","r1051619262","M3995","M新品同様/レリアン Leilian 美編ニットカーディガン 表記9号(38号/M相当) 紫/パープル 絹シルク100% 長袖 春夏秋向け トップス レディース","","","","","","","22810","1","0","22810","0","","1","","","","0","","","","","-1","0","","","発送日情報なし","10","0","0","0","未確定","0"
"10000828","2","froufroumarket-10000828","1","AUCTIONw1138245407","","w1138245407","","新品同様/レリアン Leilian テーラードジャケット 表記 9号 M 相当 ベージュ 花柄 羽織り ロング丈 薄手 軽やか 春 夏 アウター レディース","","","","","","","28930","1","0","28930","0","","1","","","","0","","","","","28254","0","","","発送日情報なし","10","0","0","0","未確定","0"
"10000827","1","froufroumarket-10000827","1","AUCTIONw1051564971","","w1051564971","A1573","A美品/theory/セオリー/綿コットン100％/爽やか長袖ブラウス/大きいサイズ/11号〜13号相当/春夏秋/トップス/レディース","","","","","","","12800","1","0","12800","0","","1","","","","0","","","","","-1","0","","","発送日情報なし","10","0","0","0","未確定","0"
"10000827","2","froufroumarket-10000827","1","AUCTIONc1051236768","","c1051236768","H247","H美品/ INDIVI インディヴィ ふっくら柔らかニットセーター 表記38号(Mサイズ相当) 黒/ブラック 秋冬向け ウール混 トップス レディース","","","","","","","5500","1","0","5500","0","","1","","","","0","","","","","-1","0","","","発送日情報なし","10","0","0","0","未確定","0"
"10000827","3","froufroumarket-10000827","1","AUCTIONu1051239659","","u1051239659","H129","H美品/LOLO Collection ロロコレクション 美形ジャケット 大きいサイズ表記42号(13号LL相当) グレー 秋冬向 ツイード アウター レディース","","","","","","","5500","1","0","5500","0","","1","","","","0","","","","","-1","0","","","発送日情報なし","10","0","0","0","未確定","0"
"10000826","1","froufroumarket-10000826","1","A5562","","","","美品/伊太利屋 GK 中綿入りベスト 表記 11号 L 相当 茶 ブラウン ヒョウ柄 ワッペン 軽やか おしゃれ お出掛け 秋 冬 トップス レディース","","","","","","","21230","1","0","21230","0","","1","","","","0","2024/09/18","","","","","0","2024/09/17","2024/09/17","翌日発送（休業日を除く）","10","193","193","1","2024-09-17","193"
"10000825","1","froufroumarket-10000825","1","AUCTIONk1051567940","","k1051567940","A2841","Ａ美品/トゥービーシック TO BE CHIC 美揺れフレアスカート 表記42号(9号/M相当) 青/ブルー デニム素材 プリーツデザイン 春夏 ボトムス","","","","","","","14900","1","0","14900","0","","1","","","","0","","","","","-1","0","","","発送日情報なし","10","0","0","0","未確定","0"
"10000824","1","froufroumarket-10000824","1","M5770","","l1078736908","","美品/エスプリ ESPRIT テーラードジャケット 小さいサイズ 表記I38 D34 S 7号相当 紫 藤色 シンプル ストレッチ 秋 冬 アウター レディース","","","","","","","16830","1","0","16830","0","","1","","","","0","","","","","28254","0","2024/09/14","2024/09/14","翌日発送（休業日を除く）","10","0","0","0","未確定","0"
"10000823","1","froufroumarket-10000823","1","M6523","","v1113965582","","美品/レキップ ヨシエイナバ L'EQUIPE YOSHIE INABA デニムジャケット 表記 11号 L 相当 古着 濃紺 レディース 春 秋 アウター 長袖 綿","","","","","","","15290","1","0","15290","0","","1","","","","0","","","","","28257","0","2024/09/14","2024/09/14","翌日発送（休業日を除く）","10","0","0","0","未確定","0"
"10000822","1","froufroumarket-10000822","1","AUCTIONu1051696833","","u1051696833","A1119","A美品*Paul Smith*ポールスミス*ロゴ釦*美脚デニムパンツ38/9","","","","","","","4110","1","0","4110","0","","1","","","","0","","","","","-1","0","","","発送日情報なし","10","0","0","0","未確定","0"
"10000821","1","froufroumarket-10000821","1","AUCTION1051568836","","1051568836","A1656","A美品/22 OCTOBRE/22オクトーブル/グレー/艶感/微小幾何学柄/煌びやかラメ/素敵スカートスーツ/38号(9号*M相当)秋冬/レディース","","","","","","","12800","1","0","12800","0","","1","","","","0","","","","","-1","0","","","発送日情報なし","10","0","0","0","未確定","0"
"10000820","1","froufroumarket-10000820","1","M7053","","u1141513293","","新品同様/mimosalip カーディガン 総レース 表記 M〜L 9号 11号 相当 古着 黒 ブラック レディース 春 夏 トップス 長袖 透け感 シースルー","","","","","","","8360","1","0","8360","0","","1","","","","0","","","","","4859","0","2024/09/09","2024/09/09","翌日発送（休業日を除く）","10","0","0","0","未確定","0"
"10000819","1","froufroumarket-10000819","1","AUCTIONf1051447533","","f1051447533","A2260","A新品同様/ インソレンテ insolente 素敵チュニック 表記 M〜L(9号/11号) 青/黒 伸縮性素材 フランス製 モダン美柄 春夏 トップス","","","","","","","9799","1","0","9799","0","","1","","","","0","","","","","-1","0","","","発送日情報なし","10","0","0","0","未確定","0"
"10000818","1","froufroumarket-10000818","1","M6510","","o1113218505","","美品/プライドグライド prideglide ラップスカート ミニスカート 小さいサイズ 表記 36号 S 相当 グレー 毛100 レディース 秋 冬 ボトムス","","","","","","","11770","1","0","11770","0","","1","","","","0","","","","","40744","0","2024/09/08","2024/09/08","翌日発送（休業日を除く）","10","0","0","0","未確定","0"
"10000817","1","froufroumarket-10000817","1","AUCTIONx1051569972","","x1051569972","H347","H美品/smart pink スマートピンク モダン柄ストレッチチュニック 表記40号(11号Lサイズ相当) 茶/緑/ブラウン 春夏向け トップス レディース","","","","","","","12800","1","0","12800","0","","1","","","","0","","","","","-1","0","","","発送日情報なし","10","0","0","0","未確定","0"
"10000816","1","froufroumarket-10000816","1","AUCTIONh1051679645","","h1051679645","A3554","Ａ美品/ピンキー&ダイアン Pinky&Dianne 大人なフリルブラウス 表記38号(9号/M相当) 黒/ブラック お食事会 春夏向け トップス レディース","","","","","","","4110","1","0","4110","0","","1","","","","0","","","","","-1","0","","","発送日情報なし","10","0","0","0","未確定","0"
"10000815","1","froufroumarket-10000815","1","AUCTIONm1051570112","","m1051570112","M3611","M美品/ダナキャラン DKNY イタリア製スカートスーツ 表記I42 I44(9号/M〜11号/L相当) アイボリー 絹シルク&綿コットン素材 春秋 レディース","","","","","","","15899","1","0","15899","0","","1","","","","0","","","","","-1","0","","","発送日情報なし","10","0","0","0","未確定","0"
"10000814","1","froufroumarket-10000814","1","AUCTIONu1051233244","","u1051233244","A3749","Ａ美品/伊太利屋 ジップアップニットカーディガン 表記9号(M相当) 白 黒 グレー アンゴラ混 トナカイ 秋冬向け トップス レディース","","","","","","","12800","1","0","12800","0","","1","","","","0","","","","","-1","0","","","発送日情報なし","10","0","0","0","未確定","0"
"10000813","1","froufroumarket-10000813","1","A5126","","","","美品/ユキコハナイ yukiko hanai フレアスカート 表記 8号 9号 相当 黒 ブラック ダマスク柄 艶感 高級感 春 秋 ボトムス レディース","","","","","","","11000","1","0","11000","0","","1","","","","0","2024/09/01","","","","","0","2024/08/30","2024/08/30","翌日発送（休業日を除く）","10","100","100","1","2024-08-31","100"
"10000812","1","froufroumarket-10000812","1","AUCTIONo1051571887","","o1051571887","A3088","Ａ美品/レリアン Leilian 上品な美形ジャケット 大きいサイズ 表記13号(LLサイズ相当) フランス製生地 繊細な美柄デザイン 秋冬 アウター","","","","","","","42801","1","0","42801","0","","1","","","","0","","","","","-1","0","","","発送日情報なし","10","0","0","0","未確定","0"
"10000811","1","froufroumarket-10000811","1","AUCTIONv1051599891","","v1051599891","A1089","A新品同様*コムサデモード*グレー*ボックスプリーツスカート11","","","","","","","5000","1","0","5000","0","","1","","","","0","","","","","-1","0","","","発送日情報なし","10","0","0","0","未確定","0"
"10000810","1","froufroumarket-10000810","1","M7078","","","","美品/ビースリー B-Three B3 ロングパンツ 表記 32号 9号 M 相当 キャメル系 レディース 春 秋 冬 ボトムス 綿混 コットン ストレッチ","","","","","","","6600","1","0","6600","0","","1","","","","0","2024/08/28","","","","","0","2024/08/23","2024/08/23","翌日発送（休業日を除く）","10","60","60","1","2024-08-27","60"
"10000809","1","froufroumarket-10000809","1","AUCTIONd1051219332","","d1051219332","A3752","Ａ美品/ジュンアシダ jun ashida 大人な美的スカートスーツ 表記11号(L相当) ピンク 絹シルク ヘリンボーン柄 パーティー 春秋 レディース","","","","","","","24800","1","0","24800","0","","1","","","","0","","","","","-1","0","","","発送日情報なし","10","0","0","0","未確定","0"
"10000808","1","froufroumarket-10000808","1","A4956","","x1105627628","","新品同様/ソニアバレンシア SONIA BALENCIA ブラックフォーマルワンピース 表記 9AR M 相当 黒 ブラック 2P風 冠婚葬祭 春夏 レディース","","","","","","","17930","1","0","17930","0","","1","","","","0","","","","","40769","0","2024/08/23","2024/08/23","","10","0","0","0","未確定","0"
"10000807","1","froufroumarket-10000807","1","AUCTIONc1125717112","","c1125717112","","美品/ビースリー B3 B-three デニムパンツ 表記 34号 11号 相当 白 ホワイト ストレッチ性 シンプル お出掛け 春 秋 ボトムス レディース","","","","","","","7700","1","0","7700","0","","1","","","","0","","","","","44120","0","2024/08/13","2024/08/13","翌日発送（休業日を除く）","10","0","0","0","未確定","0"
"10000806","1","froufroumarket-10000806","1","AUCTIONq1051234320","","q1051234320","A3306","Ａ新品/ダーマコレクション DAMA collection 涼しげな美脚パンツ (11号/L相当) グレー 麻リネン100％ 春夏向け ボトムス レディース","","","","","","","5500","1","0","5500","0","","1","","","","0","","","","","-1","0","","","発送日情報なし","10","0","0","0","未確定","0"
"10000805","1","froufroumarket-10000805","1","M6683","","","","新品/ポートランド PORT LAND ラップスカート 巻きスカート 表記 3号 11号 L 相当 紺 ネイビー レディース 春 夏 綿混 前開き シンプル","","","","","","","7700","1","0","7700","0","","1","","","","0","2024/08/12","","","","","0","2024/08/16","2024/08/16","","10","70","70","1","2024-08-11","70"
"10000804","1","froufroumarket-10000804","1","M5058","","u1002045810","","美品/ユナイテッドカラーズオブベネトン BENETTON 麻リネン100％ワンピース イタリア製 表記M(9号相当) 黒/ブラック 春夏向け レディース","","","","","","","8470","1","0","8470","0","","1","","","","0","","","","","44841","0","2024/08/10","2024/08/10","翌日発送（休業日を除く）","10","0","0","0","未確定","0"
"10000803","1","froufroumarket-10000803","1","AUCTIONm1051612865","","m1051612865","6749","新品同様/レリアン Leilian 美柄シフォンカットソー 表記11号(Lサイズ相当) ピンク系 ペーズリー柄 春夏向け トップス レディース","","","","","","","6790","1","0","6790","0","","1","","","","0","","","","","-1","0","","","発送日情報なし","10","0","0","0","未確定","0"
"10000802","1","froufroumarket-10000802","1","AUCTIONe1051557856","","e1051557856","6378","新品同様/伊太利屋 アニマル柄お洒落ジャケット 表記7号(11号/Lサイズ相当) 茶/ブラウン 春秋冬向け アウター レディース","","","","","","","24900","1","0","24900","0","","1","","","","0","","","","","-1","0","","","発送日情報なし","10","0","0","0","未確定","0"
"10000801","1","froufroumarket-10000801","1","AUCTIONs1051244071","","s1051244071","M3940","M美品/スキャパ SCAPA 上品ツイードジャケット 表記40号(11号/L相当) ベージュ 綿&麻リネン混 ノーカラー 春秋向け アウター レディース","","","","","","","12900","1","0","12900","0","","1","","","","0","","","","","-1","0","","","発送日情報なし","10","0","0","0","未確定","0"
"10000800","1","froufroumarket-10000800","1","M5878","","u1082504116","","新品同様/東京ソワール TOKYO SOIR フォーマルスカート 表記11号 L相当 黒 ブラック レディース 春 夏 ボトムス プリーツ加工 シフォン","","","","","","","18590","1","0","18590","0","","1","","","","0","","","","","40745","0","2024/07/25","2024/07/25","翌日発送（休業日を除く）","10","0","0","0","未確定","0"
"10000799","1","froufroumarket-10000799","1","AUCTIONk1051617709","","k1051617709","H461","H新品同様/メルローズ MELROSE 美形ノースリーブカットソー (9号Mサイズ相当) 黒/ブラック/白 春夏向け モノトーン トップス レディース","","","","","","","3950","1","0","3950","0","","1","","","","0","","","","","-1","0","","","発送日情報なし","10","0","0","0","未確定","0"
"10000798","1","froufroumarket-10000798","1","AUCTIONm1051570568","","m1051570568","A3185","Ａ美品/ユナイテッドカラーズオブベネトン UNITED COLORS OF BENETTON デニムスカート 小さめ 表記40号(7号相当) ブルー ボトムス 春秋向け","","","","","","","5600","1","0","5600","0","","1","","","","0","","","","","-1","0","","","発送日情報なし","10","0","0","0","未確定","0"
"10000797","1","froufroumarket-10000797","1","A5490","","e1136261641","","美品/ユキトリイ YUKI TORII フリルカーディガン 表記 L 11号 相当 白 ホワイト プリーツ 薄手 七分袖 ハーフ丈 春 夏 トップス レディース","","","","","","","17050","1","0","17050","0","","1","","","","0","","","","","4859","0","2024/07/20","2024/07/20","翌日発送（休業日を除く）","10","0","0","0","未確定","0"
"10000796","1","froufroumarket-10000796","1","M4350","","","","新品同様/マンゴ MANGO 清楚ノーカラージャケット 大きいサイズ 表記USA/L(LL相当) 白/ホワイト 羽織 シンプル 春夏秋 アウター レディース","","","","","","","19800","1","0","19800","0","","1","","","","0","2024/07/21","","","","","0","2024/07/19","2024/07/19","翌日発送（休業日を除く）","10","180","180","1","2024-07-20","180"
