"OrderId","LineId","Id","Quantity","ItemId","SubCode","ItemYahooAucId","ItemYahooAucMerchantId","Title","ItemOptionName","ItemOptionValue","ItemOptionPrice","SubCodeOption","InscriptionName","InscriptionValue","UnitPrice","PriceType","UnitGetPoint","LineSubTotal","LineGetPoint","PointFspCode","Condition","CouponId","CouponDiscount","OriginalPrice","IsGetPointFix","GetPointFixDate","ReleaseDate","GetPointType","Jan","ProductId","LineGetPointChargedToStore","LeadTimeStart","LeadTimeEnd","LeadTimeText","ItemTaxRatio","UnitGetStoreBonus","LineGetBonus","IsGetStoreBonusFix","GetStoreBonusFixDate","LineGetBonusChargedToStore"
"10000970","1","froufroumarket-10000970","1","M7079","","g1142426105","","美品/ビースリー B-Three B3 クロップドパンツ 表記 34号 11号 L 相当 白 レディース 春 夏 ボトムス 綿混 コットン ストレッチ シンプル","","","","","","","6600","1","0","6600","0","","1","","","","0","","","","","40749","0","2025/04/19","2025/04/19","翌日発送（休業日を除く）","10","0","0","0","未確定","0"
"10000969","1","froufroumarket-10000969","1","AUCTIONu1051454813","","u1051454813","A1631","A美品/B3/ビースリー/白/ストレッチ素材/ロゴ釦/茶ステッチライン/お洒落カプリパンツ/小さいサイズ/32号(7号*Ｓ相当)春夏/レディース","","","","","","","3800","1","0","3800","0","","1","","","","0","","","","","-1","0","","","発送日情報なし","10","0","0","0","未確定","0"
"10000968","1","froufroumarket-10000968","1","A5560","","","","美品/ユキトリイ YUKI TORII フォーマルジャケット 9号 M 相当 白 ホワイト 艶感 無地 ステンカラー リボン 春 秋 アウター レディース","","","","","","","28600","1","0","28600","0","","1","","","","0","2025/04/17","","","","","0","2025/04/19","2025/04/19","","10","260","260","1","2025-04-16","260"
"10000967","1","froufroumarket-10000967","1","AUCTIONq1051609405","","q1051609405","M3012","M美品/フラジール FRAGILE 可憐フリル付きスカート 小さいサイズ 表記36号(7号/S相当) シルバーグレー 伸縮 春夏向け ボトムス レディース","","","","","","","6000","1","0","6000","0","","1","","","","0","","","","","-1","0","","","発送日情報なし","10","0","0","0","未確定","0"
"10000966","1","froufroumarket-10000966","1","M7056","","c1141976591","","美品/ピサーノ PISANO ジュニアー プリーツスカート 表記 L 11号 相当 古着 黒 ブラック レディース 春 夏 ボトムス しわ感 透け感 薄手","","","","","","","10450","1","0","10450","0","","1","","","","0","","","","","40745","0","2025/04/13","2025/04/13","翌日発送（休業日を除く）","10","0","0","0","未確定","0"
"10000965","1","froufroumarket-10000965","1","A5104","","s1112932898","","美品/レリアン Leilian フレアスカート 表記 11号 L 相当 黒 ブラック 毛 ウール 格子柄 ひざ丈 オフィス 春秋 ボトムス レディース","","","","","","","15400","1","0","15400","0","","1","","","","0","","","","","40745","0","2025/04/13","2025/04/13","翌日発送（休業日を除く）","10","0","0","0","未確定","0"
"10000964","1","froufroumarket-10000964","1","M5801","","t1079196619","","美品/マーガレットハウエル MARGARET HOWELL フレアスカート 表記2号 M相当 ベージュ 綿 毛 シンプル ミモレ丈 春秋冬 ボトムス レディース","","","","","","","9020","1","0","9020","0","","1","","","","0","","","","","40745","0","2025/04/08","2025/04/08","翌日発送（休業日を除く）","10","0","0","0","未確定","0"
"10000963","1","froufroumarket-10000963","1","AUCTIONm1051611220","","m1051611220","M3239","M新品同様/イエーガー JAEGER ゆったりロングパンツ 小さいサイズ 表記W63 H91(7号/S相当) 黒/ブラック 麻混 春夏向 ボトムス レディース","","","","","","","5951","1","0","5951","0","","1","","","","0","","","","","-1","0","","","発送日情報なし","10","0","0","0","未確定","0"
"10000962","1","froufroumarket-10000962","1","AUCTIONl1051595190","","l1051595190","M3238","M美品/ラルフローレンゴルフ RALPH LAUREN 優秀スコート 表記2号(身長160) 白/ホワイト ゴルフウエア 伸縮 春夏向け ボトムス レディース","","","","","","","5951","1","0","5951","0","","1","","","","0","","","","","-1","0","","","発送日情報なし","10","0","0","0","未確定","0"
"10000961","1","froufroumarket-10000961","1","M5821","","","","美品/アナイ ANAYI ワンピース 半袖ワンピース 表記38号 9号 Ｍ相当 古着 濃紺 ネイビー レディース 春 夏 秋 ノーカラー シンプル ひざ丈","","","","","","","14190","1","0","14190","0","","1","","","","0","2025/04/07","","","","","0","2025/04/09","2025/04/09","","10","129","129","1","2025-04-06","129"
"10000960","1","froufroumarket-10000960","1","M5307","","r1038386796","","美品/ベルソフィア Bell Sophia フォーマル ジャケット 大きいサイズ 表記13号 LL相当 シャンパンゴールド 総レース アウター レディース","","","","","","","22000","1","0","22000","0","","1","","","","0","","","","","1480","0","2025/03/31","2025/03/31","翌日発送（休業日を除く）","10","0","0","0","未確定","0"
"10000959","1","froufroumarket-10000959","1","M6270","","h1099608478","","美品/B PLUS ブラウス スカート セットアップ 大きいサイズ 表記 17号 4L 相当 古着 シルバーグレー系 レディース 春 夏 ラメ 薄手 長袖","","","","","","","19800","1","0","19800","0","","1","","","","0","","","","","1480","0","2025/03/30","2025/03/30","翌日発送（休業日を除く）","10","0","0","0","未確定","0"
"10000958","1","froufroumarket-10000958","1","AUCTIONe1051602657","","e1051602657","M2347","M美品/KOJI WATANABE/コージワタナベ/淡ピンク/コットン/カットソー/トップス/M（9号/38号相当）/春夏/レディース","","","","","","","3960","1","0","3960","0","","1","","","","0","","","","","-1","0","","","発送日情報なし","10","0","0","0","未確定","0"
"10000957","1","froufroumarket-10000957","1","M6251","","f1098635678","","美品/グレープ横浜元町 grape ワイドパンツ 9号 M 11号 L 相当 グレー レディース 春 夏 秋 ボトムス 麻混 綿混 シンプル ゆったり ゴム","","","","","","","5500","1","0","5500","0","","1","","","","0","","","","","28530","0","2025/03/29","2025/03/29","翌日発送（休業日を除く）","10","0","0","0","未確定","0"
"10000956","1","froufroumarket-10000956","1","A5462","","u1133285787","","美品/ビースリー B3 デニムパンツ 表記 38号 11号 相当 白 ホワイト シンプル ストレッチ性 ロング丈 お出掛け 春 秋 ボトムス レディース","","","","","","","8800","1","0","8800","0","","1","","","","0","","","","","44120","0","2025/03/27","2025/03/27","翌日発送（休業日を除く）","10","0","0","0","未確定","0"
"10000955","1","froufroumarket-10000955","1","M7436","","s1163119126","","美品/レキップ ヨシエイナバ L'EQUIPE YOSHIE INABA フレアスカート 40号 L 相当 茶 ブラウン レディース ボトムス 絹 綿 レース 薄手","","","","","","","11000","1","0","11000","0","","1","","","","0","","","","","40746","0","2025/03/26","2025/03/26","翌日発送（休業日を除く）","10","0","0","0","未確定","0"
"10000954","1","froufroumarket-10000954","1","M7494","","","","新品同様/ユキトリイ YUKI TORII イギン ブラックフォーマルワンピーススーツ 表記 9号 M 相当 黒 レディース 冠婚葬祭 喪服 セットアップ","","","","","","","33000","1","0","33000","0","","1","","","","0","2025/03/27","","","","","0","2025/03/28","2025/03/28","","10","280","280","1","2025-03-26","280"
"10000953","1","froufroumarket-10000953","1","AUCTIONe1051552549","","e1051552549","A3661","Ａ新品同様/CELEB-MOI 大人なセットアップスーツ 表記M〜L(9号 11号相当) 黒/ブラック しわ感素材 繊細プリーツ モダンなデザイン 春夏向け","","","","","","","9801","1","0","9801","0","","1","","","","0","","","","","-1","0","","","発送日情報なし","10","0","0","0","未確定","0"
"10000952","1","froufroumarket-10000952","1","A4651","","n1088206189","","美品/23区 テーラードジャケット 大きい 表記 50号 19号 5L 相当 グレー ストライプ柄 ロング丈 オフィス 通勤 アウター 春夏 レディース","","","","","","","18700","1","0","18700","0","","1","","","","0","","","","","28254","0","2025/03/18","2025/03/18","翌日発送（休業日を除く）","10","0","0","0","未確定","0"
"10000951","1","froufroumarket-10000951","1","AUCTIONc1051571101","","c1051571101","A2730","Ａ新品/ OPPIO 美的タイトスカート 表記Ｍサイズ(9号相当) 黒/ブラック ニット素材 ウール100 オフィス 秋冬向け ボトムス","","","","","","","6300","1","0","6300","0","","1","","","","0","","","","","-1","0","","","発送日情報なし","10","0","0","0","未確定","0"
"10000950","1","froufroumarket-10000950","1","M5043","","o497580154","","美品/デリススポーツ DELICE sport 東京スタイル ブラウス/スカートセットアップ 大きいサイズ 表記上19号 下17号 赤系 春夏向 レディース","","","","","","","8800","1","0","8800","0","","1","","","","0","","","","","28364","0","2025/03/15","2025/03/15","翌日発送（休業日を除く）","10","0","0","0","未確定","0"
"10000949","1","froufroumarket-10000949","1","AUCTIONl1051555191","","l1051555191","4306","☆ボルボネーゼ♪キャメル*金釦♪美形ジャケット*大きいサイズ44","","","","","","","5200","1","0","5200","0","","1","","","","0","","","","","-1","0","","","発送日情報なし","10","0","0","0","未確定","0"
"10000948","1","froufroumarket-10000948","1","AUCTIONf1051571756","","f1051571756","S261","S【マークジェイコブス】美彩色*絹100％*透け感*華花柄スカート9","","","","","","","3800","1","0","3800","0","","1","","","","0","","","","","-1","0","","","発送日情報なし","10","0","0","0","未確定","0"
"10000947","1","froufroumarket-10000947","1","M7114","","g1144382731","","新品同様/ソワールドルチェ SOIR DOLCE 東京ソワール フォーマルスカート 表記 11号 L 相当 黒 ブラック レディース 春 夏 単品 ロング","","","","","","","17050","1","0","17050","0","","1","","","","0","","","","","1480","0","2025/03/10","2025/03/10","翌日発送（休業日を除く）","10","0","0","0","未確定","0"
"10000946","1","froufroumarket-10000946","1","M7415","","q1162723829","","新品同様/ユキトリイ YUKI TORII ワンピース 表記 38号 9号 M 相当 古着 紺 ネイビー レディース 春 秋 5分袖 絹混 毛混 ジャガード 膝丈","","","","","","","22000","1","0","22000","0","","1","","","","0","","","","","44841","0","2025/03/08","2025/03/08","翌日発送（休業日を除く）","10","0","0","0","未確定","0"
"10000945","1","froufroumarket-10000945","1","AUCTIONk1051237438","","k1051237438","A2509","A美品/ ロペ ROPE 大人なオーバーブラウス 表記38号(Mサイズ相当) 紺/ネイビー ウール素材 オフィス 秋冬向け トップス レディース","","","","","","","5480","1","0","5480","0","","1","","","","0","","","","","-1","0","","","発送日情報なし","10","0","0","0","未確定","0"
"10000944","1","froufroumarket-10000944","1","AUCTIONf1051605027","","f1051605027","A3744","Ａ新品/詩仙堂 ヒトシタムラ 高級ちりめんロングベスト (9号/M相当) 緑/グリーン モダンデザイン 春秋向け トップス レディース","","","","","","","22810","1","0","22810","0","","1","","","","0","","","","","-1","0","","","発送日情報なし","10","0","0","0","未確定","0"
"10000943","1","froufroumarket-10000943","1","A5120","","h1113719066","","新品/ローラアシュレイ LAURA ASHLEY ジャージワンピース 表記 11号 L 相当 紺 ネイビー 花柄 Vネック 七分袖 お出掛け 春 夏 レディース","","","","","","","20900","1","0","20900","0","","1","","","","0","","","","","44841","0","2025/03/11","2025/03/11","","10","0","0","0","未確定","0"
"10000942","1","froufroumarket-10000942","1","M4751","","d485230680","","新品同様/エルミダ EL MIDAS 優雅フォーマルジャケット 表記10号(11号相当) 紺 フロッキー風 煌ラメ ノーカラー 毛絹混 春秋冬 レディース","","","","","","","20570","1","0","20570","0","","1","","","","0","","","","","28256","0","2025/03/04","2025/03/04","翌日発送（休業日を除く）","10","0","0","0","未確定","0"
"10000941","1","froufroumarket-10000941","1","M7484","","q1165942384","","美品/セオリーリュクス theory luxe ベスト 表記 38号 M 相当 黒 ブラック レディース 春 秋 トップス 毛100 ウール vネック 薄手 前開き","","","","","","","7700","1","0","7700","0","","1","","","","0","","","","","40699","0","2025/03/03","2025/03/03","翌日発送（休業日を除く）","10","0","0","0","未確定","0"
"10000940","1","froufroumarket-10000940","1","M7567","","j1171143553","","美品/トランスワーク TRANS WORK スカートスーツ イタリア製生地 11号 13号 茶 ブラウン レディース 春 秋 2点セット 毛100 ウール 薄手","","","","","","","15840","1","0","15840","0","","1","","","","0","","","","","1480","0","2025/03/02","2025/03/02","翌日発送（休業日を除く）","10","0","0","0","未確定","0"
"10000939","1","froufroumarket-10000939","1","M7234","","","","美品/フラジール FRAGILE フレアスカート 表記 38号 9号 M 相当 白黒 レディース 春 夏 ボトムス 薄手 ひざ丈 ストレッチ ジャージ素材","","","","","","","6600","1","0","6600","0","","1","","","","0","","","","","","0","2025/03/06","2025/03/06","","10","0","0","0","未確定","0"
"10000938","1","froufroumarket-10000938","1","AUCTIONb1051600780","","b1051600780","M2838","M美品/ラルフローレン RALPH LAUREN ウール100%ニット 表記L号(11号/40号相当) グレー 定番シンプル 伸縮 長袖 秋冬 トップス レディース","","","","","","","7000","1","0","7000","0","","1","","","","0","","","","","-1","0","","","発送日情報なし","10","0","0","0","未確定","0"
"10000937","1","froufroumarket-10000937","1","AUCTIONb1051552292","","b1051552292","6757","美品/ジャンフランコフェレ GIANFRANCO FERRE すらっと美脚パンツ 小さいサイズ表記38号(７/S相当) グレー 伊製 春夏 ボトムス レディース","","","","","","","6300","1","0","6300","0","","1","","","","0","","","","","-1","0","","","発送日情報なし","10","0","0","0","未確定","0"
"10000936","1","froufroumarket-10000936","1","AUCTIONk1051696344","","k1051696344","M3823","M美品/タルボット Talbots 花柄フレアスカート 絹シルク100% 大きいサイズ 表記12号(13号〜15号相当) 黒 赤 春夏向け ボトムス レディース","","","","","","","4990","1","0","4990","0","","1","","","","0","","","","","-1","0","","","発送日情報なし","10","0","0","0","未確定","0"
"10000935","1","froufroumarket-10000935","1","M6727","","q1124125258","","美品/ボディドレッシングデラックス BODY DRESSING Deluxe タイトスカート 小さい 36号 S 相当 黒 ブラック レディース 秋 冬 ボトムス","","","","","","","7700","1","0","7700","0","","1","","","","0","","","","","40745","0","2025/02/27","2025/02/27","翌日発送（休業日を除く）","10","0","0","0","未確定","0"
"10000934","1","froufroumarket-10000934","1","M7405","","n1161946031","","美品/Ebegcnce ニットカーディガン リバーシブル 表記 L 11号 相当 古着 茶 ブラウン オレンジ レディース 秋 冬 トップス 毛100 ウール","","","","","","","7700","1","0","7700","0","","1","","","","0","","","","","4859","0","2025/02/26","2025/02/26","翌日発送（休業日を除く）","10","0","0","0","未確定","0"
"10000933","1","froufroumarket-10000933","1","AUCTIONr1051242996","","r1051242996","M3836","M新品同様/ボンシリエ BON CILIE 優雅ベロアジャケット 表記9号(M相当) 黒 透け感 プリーツ 薄手 フリル ラメ 春秋 アウター レディース","","","","","","","24900","1","0","24900","0","","1","","","","0","","","","","-1","0","","","発送日情報なし","10","0","0","0","未確定","0"
"10000932","1","froufroumarket-10000932","1","AUCTIONx1051235733","","x1051235733","H114","H美品/INDIVI インディヴィ 極柔ウールジャケット 小さいサイズ表記38号(7号相当) 黒/ブラック アンゴラ混 秋冬向け アウター レディース","","","","","","","12900","1","0","12900","0","","1","","","","0","","","","","-1","0","","","発送日情報なし","10","0","0","0","未確定","0"
"10000931","1","froufroumarket-10000931","1","AUCTIONg1051232318","","g1051232318","5767","新品同様*SACRAサクラ*ふっくらツイード風*斜めレジメ柄*お洒落スカート38/9","","","","","","","5480","1","0","5480","0","","1","","","","0","","","","","-1","0","","","発送日情報なし","10","0","0","0","未確定","0"
"10000930","1","froufroumarket-10000930","1","M7600","","t1173158991","","美品/バレンザ VALENZA ロングパンツ ストレッチ 大きいサイズ 表記 42号 LL 相当 古着 黒 ブラック レディース 秋 冬 ボトムス ビジュー","","","","","","","8690","1","0","8690","0","","1","","","","0","","","","","40707","0","2025/02/20","2025/02/20","翌日発送（休業日を除く）","10","0","0","0","未確定","0"
"10000929","1","froufroumarket-10000929","1","AUCTIONx1051564872","","x1051564872","M1882","M美品*スコッチハウス*渋色*プリーツスカート♪小さいサイズ36/7","","","","","","","5600","1","0","5600","0","","1","","","","0","","","","","-1","0","","","発送日情報なし","10","0","0","0","未確定","0"
"10000928","1","froufroumarket-10000928","1","M6969","","j1136661360","","美品/ミスクロエ Miss Chloe タイトスカート ツイード 表記 40号 11号 L 相当 古着 紺 ネイビー レディース 秋 冬 ボトムス 毛100 ウール","","","","","","","9020","1","0","9020","0","","1","","","","0","","","","","40745","0","2025/02/14","2025/02/14","翌日発送（休業日を除く）","10","0","0","0","未確定","0"
"10000927","1","froufroumarket-10000927","1","A5558","","d1141224329","","美品/ペニーブラック PENNY BLACK テーラードジャケット イタリア製 表記 40号 11号 相当 黒 ブラック ウール 秋 冬 アウター レディース","","","","","","","14850","1","0","14850","0","","1","","","","0","","","","","28254","0","2025/02/13","2025/02/13","翌日発送（休業日を除く）","10","0","0","0","未確定","0"
"10000926","1","froufroumarket-10000926","1","A4156","","j662481815","","美品/マックスマーラ MaxMara ウィークエンド WEEKEND 大人な美形ニットワンピース (11号/L相当) 黒 白 モダンな美柄 お出掛け 春秋向け","","","","","","","23650","1","0","23650","0","","1","","","","0","","","","","44841","0","2025/02/12","2025/02/12","翌日発送（休業日を除く）","10","0","0","0","未確定","0"
"10000925","1","froufroumarket-10000925","0","M4604","","k503845809","","美品/東京ソワール RIFANNE 大人ノーカラージャケット 大きいサイズ 表記15号(3L相当) オレンジ 美形 金釦 春秋冬向け アウター レディース","","","","","","","28600","1","0","0","0","","1","","","","0","","","","","28256","0","2025/02/09","2025/02/09","翌日発送（休業日を除く）","10","0","0","0","未確定","0"
"10000924","1","froufroumarket-10000924","1","M7474","","u1165622989","","美品/オンワード樫山 ワンピース 表記 M 9号 38号 相当 古着 グレー レディース 秋 冬 ノーカラー シンプル ミモレ丈 長袖 ストレッチ","","","","","","","13640","1","0","13640","0","","1","","","","0","","","","","44841","0","2025/02/08","2025/02/08","翌日発送（休業日を除く）","10","0","0","0","未確定","0"
"10000923","1","froufroumarket-10000923","1","M4793","","n492841117","","新品/ignimoh's ブラックフォーマルワンピーススーツ 表記11号(L相当) 黒/ブラック レース 冠婚葬祭 喪服 春夏秋 セットアップ レディース","","","","","","","19800","1","0","19800","0","","1","","","","0","","","","","40769","0","2025/02/03","2025/02/03","翌日発送（休業日を除く）","10","0","0","0","未確定","0"
"10000922","1","froufroumarket-10000922","1","M7464","","o1165549950","","美品/アリュード ALLUDE ニット セーター 小さいサイズ 表記 XS 7号 相当 ピンク レディース 秋冬 トップス ゆったり ウール カシミヤ 極柔","","","","","","","8470","1","0","8470","0","","1","","","","0","","","","","1483","0","2025/02/02","2025/02/02","翌日発送（休業日を除く）","10","0","0","0","未確定","0"
"10000921","1","froufroumarket-10000921","1","AUCTIONq1051233988","","q1051233988","A3798","Ａ美品/レキップ ヨシエイナバ L'EQUIPE YOSHIE INABA 美形ウールジャケット 表記40号(11号/L相当) 茶/ブラウン 秋冬 アウター レディース","","","","","","","12900","1","0","12900","0","","1","","","","0","","","","","-1","0","","","発送日情報なし","10","0","0","0","未確定","0"
"10000920","1","froufroumarket-10000920","1","AUCTIONp1051682649","","p1051682649","M3310","M美品/組曲 KUMIKYOKU ツイード素材パンツ 表記2号(9号/38号/M相当) こげ茶 絹シルク混 ゆったり感 伸縮 秋冬向け ボトムス レディース","","","","","","","5200","1","0","5200","0","","1","","","","0","","","","","-1","0","","","発送日情報なし","10","0","0","0","未確定","0"
"10000919","1","froufroumarket-10000919","1","M5792","","d1079589714","","美品/三年坂 コート ちりめんコート 表記フリー 大きいサイズ 15号 17号相当 グレー 比翼 シンプル ふっくら 秋 冬 アウター レディース","","","","","","","22000","1","0","22000","0","","1","","","","0","","","","","1460","0","2025/01/28","2025/01/28","翌日発送（休業日を除く）","10","0","0","0","未確定","0"
"10000918","1","froufroumarket-10000918","1","M6536","","","","美品/エイディーアデンダ ad addenda ダウンコート 大きいサイズ 表記 13号 LL 相当 ココアブラウン レディース 秋 冬 アウター ダウン90%","","","","","","","18480","1","0","18480","0","","1","","","","0","2025/01/29","","","","","0","2025/01/31","2025/01/31","","10","168","168","1","2025-01-28","168"
"10000917","1","froufroumarket-10000917","1","M6306","","d1101964853","","美品/ダーマコレクション DAMA collection ワイドパンツ 9号 M 相当 黒 ブラック レディース 秋 冬 ボトムス ゆったり シンプル ミモレ丈","","","","","","","7150","1","0","7150","0","","1","","","","0","","","","","28530","0","2025/01/28","2025/01/28","翌日発送（休業日を除く）","10","0","0","0","未確定","0"
"10000916","1","froufroumarket-10000916","1","A5255","","w1123597111","","美品/クリッツィア KRIZIA ノーカラージャケット 大きい 表記 42号 13号 相当 ベージュ 毛 ウール 無地 ロゴ釦 秋 冬 アウター レディース","","","","","","","22880","1","0","22880","0","","1","","","","0","","","","","28256","0","2025/01/28","2025/01/28","翌日発送（休業日を除く）","10","0","0","0","未確定","0"
"10000915","1","froufroumarket-10000915","1","AUCTIONr1051575368","","r1051575368","M2581","M美品/Bowbell ちぐさボーベル 美形ジャケット 大きいサイズ13号(42号/LL相当) ピンク ウール100 格子柄 クラシカル 秋冬向け レディース","","","","","","","16000","1","0","16000","0","","1","","","","0","","","","","-1","0","","","発送日情報なし","10","0","0","0","未確定","0"
"10000914","1","froufroumarket-10000914","1","AUCTIONg1051225939","","g1051225939","A2545","A美品/ 自由区 お洒落なワンピース 表記38号(9号相当) 黒/ブラック 艶感 麻リネン混 ミリタリー調デザイン 春夏向け レディース","","","","","","","5500","1","0","5500","0","","1","","","","0","","","","","-1","0","","","発送日情報なし","10","0","0","0","未確定","0"
"10000913","1","froufroumarket-10000913","1","AUCTIONg1051225390","","g1051225390","A2304","A美品/ コントワーデコトニエ COMPTOIR DES COTONNIERS フレアスカート 表記38号(9号/M相当) 茶/ブラウン 麻リネン100％ 春夏 ボトムス","","","","","","","5500","1","0","5500","0","","1","","","","0","","","","","-1","0","","","発送日情報なし","10","0","0","0","未確定","0"
"10000912","1","froufroumarket-10000912","1","AUCTIONw1051563917","","w1051563917","A2108","A新品同様/ダジュール D'azur 大人フレアスカート (11号/Lサイズ相当) 黒 ブラック プリーツデザイン 高級ベロア素材 秋冬 ボトムス","","","","","","","9801","1","0","9801","0","","1","","","","0","","","","","-1","0","","","発送日情報なし","10","0","0","0","未確定","0"
"10000911","1","froufroumarket-10000911","1","M7390","","r1161272613","","美品/ハロッズ Harrods ポンチョコート 表記 2号 9号 M 相当 古着 ベージュ レディース 秋 冬 アウター アンゴラ 毛 ウール 羽織り 可愛い","","","","","","","11000","1","0","11000","0","","1","","","","0","","","","","40738","0","2025/01/20","2025/01/20","翌日発送（休業日を除く）","10","0","0","0","未確定","0"
