OrderTime,SubCode,Title,UnitPrice,TotalMallCouponDiscount,UsePoint,ShipCharge,Title_1,Title_2,Title_3,Title_4,Title_5,Title_6,Title_7,Title_8,Title_9,Title_10,Title_11,Title_12,Title_13,Title_14,Title_15,Title_16,Title_17,Title_18,Title_19,Title_20,Title_21,Title_22,Title_23
2025/04/18 11:21:33,,美品/ビースリー B-Three B3 クロップドパンツ 表記 34号 11号 L 相当 白 レディース 春 夏 ボトムス 綿混 コットン ストレッチ シンプル,6600,0,0,600,美品,ビースリー,B-Three,B3,クロップドパンツ,表記,34号,11号,L,相当,白,レディース,春,夏,ボトムス,綿混,コットン,ストレッチ,シンプル,,,,
2025/04/15 14:43:39,,A美品/B3/ビースリー/白/ストレッチ素材/ロゴ釦/茶ステッチライン/お洒落カプリパンツ/小さいサイズ/32号(7号*Ｓ相当)春夏/レディース,3800,0,0,600,A美品,B3,ビースリー,白,ストレッチ素材,ロゴ釦,茶ステッチライン,お洒落カプリパンツ,小さいサイズ,32号(7号*Ｓ相当)春夏,レディース,,,,,,,,,,,,
2025/04/14 12:34:19,,美品/ユキトリイ YUKI TORII フォーマルジャケット 9号 M 相当 白 ホワイト 艶感 無地 ステンカラー リボン 春 秋 アウター レディース,28600,0,0,0,美品,ユキトリイ,YUKI,TORII,フォーマルジャケット,9号,M,相当,白,ホワイト,艶感,無地,ステンカラー,リボン,春,秋,アウター,レディース,,,,,
2025/04/12 18:25:34,,M美品/フラジール FRAGILE 可憐フリル付きスカート 小さいサイズ 表記36号(7号/S相当) シルバーグレー 伸縮 春夏向け ボトムス レディース,6000,0,0,600,M美品,フラジール,FRAGILE,可憐フリル付きスカート,小さいサイズ,表記36号(7号,S相当),シルバーグレー,伸縮,春夏向け,ボトムス,レディース,,,,,,,,,,,
2025/04/12 17:47:04,,美品/ピサーノ PISANO ジュニアー プリーツスカート 表記 L 11号 相当 古着 黒 ブラック レディース 春 夏 ボトムス しわ感 透け感 薄手,10450,0,0,0,美品,ピサーノ,PISANO,ジュニアー,プリーツスカート,表記,L,11号,相当,古着,黒,ブラック,レディース,春,夏,ボトムス,しわ感,透け感,薄手,,,,
2025/04/12 15:44:42,,美品/レリアン Leilian フレアスカート 表記 11号 L 相当 黒 ブラック 毛 ウール 格子柄 ひざ丈 オフィス 春秋 ボトムス レディース,15400,0,0,0,美品,レリアン,Leilian,フレアスカート,表記,11号,L,相当,黒,ブラック,毛,ウール,格子柄,ひざ丈,オフィス,春秋,ボトムス,レディース,,,,,
2025/04/07 21:37:05,,美品/マーガレットハウエル MARGARET HOWELL フレアスカート 表記2号 M相当 ベージュ 綿 毛 シンプル ミモレ丈 春秋冬 ボトムス レディース,9020,0,0,600,美品,マーガレットハウエル,MARGARET,HOWELL,フレアスカート,表記2号,M相当,ベージュ,綿,毛,シンプル,ミモレ丈,春秋冬,ボトムス,レディース,,,,,,,,
2025/04/06 12:07:04,,M新品同様/イエーガー JAEGER ゆったりロングパンツ 小さいサイズ 表記W63 H91(7号/S相当) 黒/ブラック 麻混 春夏向 ボトムス レディース,5951,0,0,600,M新品同様,イエーガー,JAEGER,ゆったりロングパンツ,小さいサイズ,表記W63,H91(7号,S相当),黒,ブラック,麻混,春夏向,ボトムス,レディース,,,,,,,,,
2025/04/05 15:14:45,,M美品/ラルフローレンゴルフ RALPH LAUREN 優秀スコート 表記2号(身長160) 白/ホワイト ゴルフウエア 伸縮 春夏向け ボトムス レディース,5951,0,0,600,M美品,ラルフローレンゴルフ,RALPH,LAUREN,優秀スコート,表記2号(身長160),白,ホワイト,ゴルフウエア,伸縮,春夏向け,ボトムス,レディース,,,,,,,,,,
2025/04/05 14:58:10,,美品/アナイ ANAYI ワンピース 半袖ワンピース 表記38号 9号 Ｍ相当 古着 濃紺 ネイビー レディース 春 夏 秋 ノーカラー シンプル ひざ丈,14190,0,709,0,美品,アナイ,ANAYI,ワンピース,半袖ワンピース,表記38号,9号,Ｍ相当,古着,濃紺,ネイビー,レディース,春,夏,秋,ノーカラー,シンプル,ひざ丈,,,,,
2025/03/30 00:09:55,,美品/ベルソフィア Bell Sophia フォーマル ジャケット 大きいサイズ 表記13号 LL相当 シャンパンゴールド 総レース アウター レディース,22000,-1500,0,0,美品,ベルソフィア,Bell,Sophia,フォーマル,ジャケット,大きいサイズ,表記13号,LL相当,シャンパンゴールド,総レース,アウター,レディース,,,,,,,,,,
2025/03/29 14:19:39,,美品/B PLUS ブラウス スカート セットアップ 大きいサイズ 表記 17号 4L 相当 古着 シルバーグレー系 レディース 春 夏 ラメ 薄手 長袖,19800,0,0,0,美品,B,PLUS,ブラウス,スカート,セットアップ,大きいサイズ,表記,17号,4L,相当,古着,シルバーグレー系,レディース,春,夏,ラメ,薄手,長袖,,,,
2025/03/29 12:42:50,,M美品/KOJI WATANABE/コージワタナベ/淡ピンク/コットン/カットソー/トップス/M（9号/38号相当）/春夏/レディース,3960,0,0,600,M美品,KOJI,WATANABE,コージワタナベ,淡ピンク,コットン,カットソー,トップス,M（9号,38号相当）,春夏,レディース,,,,,,,,,,,
2025/03/28 07:17:05,,美品/グレープ横浜元町 grape ワイドパンツ 9号 M 11号 L 相当 グレー レディース 春 夏 秋 ボトムス 麻混 綿混 シンプル ゆったり ゴム,5500,0,0,600,美品,グレープ横浜元町,grape,ワイドパンツ,9号,M,11号,L,相当,グレー,レディース,春,夏,秋,ボトムス,麻混,綿混,シンプル,ゆったり,ゴム,,,
2025/03/26 17:08:53,,美品/ビースリー B3 デニムパンツ 表記 38号 11号 相当 白 ホワイト シンプル ストレッチ性 ロング丈 お出掛け 春 秋 ボトムス レディース,8800,-300,0,600,美品,ビースリー,B3,デニムパンツ,表記,38号,11号,相当,白,ホワイト,シンプル,ストレッチ性,ロング丈,お出掛け,春,秋,ボトムス,レディース,,,,,
2025/03/25 12:04:42,,美品/レキップ ヨシエイナバ L'EQUIPE YOSHIE INABA フレアスカート 40号 L 相当 茶 ブラウン レディース ボトムス 絹 綿 レース 薄手,11000,0,0,0,美品,レキップ,ヨシエイナバ,L'EQUIPE,YOSHIE,INABA,フレアスカート,40号,L,相当,茶,ブラウン,レディース,ボトムス,絹,綿,レース,薄手,,,,,
2025/03/22 16:50:55,,新品同様/ユキトリイ YUKI TORII イギン ブラックフォーマルワンピーススーツ 表記 9号 M 相当 黒 レディース 冠婚葬祭 喪服 セットアップ,33000,-2000,0,0,新品同様,ユキトリイ,YUKI,TORII,イギン,ブラックフォーマルワンピーススーツ,表記,9号,M,相当,黒,レディース,冠婚葬祭,喪服,セットアップ,,,,,,,,
2025/03/19 08:28:47,,Ａ新品同様/CELEB-MOI 大人なセットアップスーツ 表記M〜L(9号 11号相当) 黒/ブラック しわ感素材 繊細プリーツ モダンなデザイン 春夏向け,9801,0,0,600,Ａ新品同様,CELEB-MOI,大人なセットアップスーツ,表記M〜L(9号,11号相当),黒,ブラック,しわ感素材,繊細プリーツ,モダンなデザイン,春夏向け,,,,,,,,,,,,
2025/03/17 09:57:58,,美品/23区 テーラードジャケット 大きい 表記 50号 19号 5L 相当 グレー ストライプ柄 ロング丈 オフィス 通勤 アウター 春夏 レディース,18700,0,0,0,美品,23区,テーラードジャケット,大きい,表記,50号,19号,5L,相当,グレー,ストライプ柄,ロング丈,オフィス,通勤,アウター,春夏,レディース,,,,,,
2025/03/17 01:25:27,,Ａ新品/ OPPIO 美的タイトスカート 表記Ｍサイズ(9号相当) 黒/ブラック ニット素材 ウール100 オフィス 秋冬向け ボトムス,6300,0,0,600,Ａ新品,OPPIO,美的タイトスカート,表記Ｍサイズ(9号相当),黒,ブラック,ニット素材,ウール100,オフィス,秋冬向け,ボトムス,,,,,,,,,,,,
2025/03/14 10:55:36,,美品/デリススポーツ DELICE sport 東京スタイル ブラウス/スカートセットアップ 大きいサイズ 表記上19号 下17号 赤系 春夏向 レディース,8800,-2000,0,600,美品,デリススポーツ,DELICE,sport,東京スタイル,ブラウス,スカートセットアップ,大きいサイズ,表記上19号,下17号,赤系,春夏向,レディース,,,,,,,,,,
2025/03/14 10:47:17,,☆ボルボネーゼ♪キャメル*金釦♪美形ジャケット*大きいサイズ44,5200,-111,0,600,☆ボルボネーゼ♪キャメル*金釦♪美形ジャケット*大きいサイズ44,,,,,,,,,,,,,,,,,,,,,,
2025/03/12 07:54:04,,S【マークジェイコブス】美彩色*絹100％*透け感*華花柄スカート9,3800,0,0,600,S【マークジェイコブス】美彩色*絹100％*透け感*華花柄スカート9,,,,,,,,,,,,,,,,,,,,,,
2025/03/09 12:52:45,,新品同様/ソワールドルチェ SOIR DOLCE 東京ソワール フォーマルスカート 表記 11号 L 相当 黒 ブラック レディース 春 夏 単品 ロング,17050,-1705,0,0,新品同様,ソワールドルチェ,SOIR,DOLCE,東京ソワール,フォーマルスカート,表記,11号,L,相当,黒,ブラック,レディース,春,夏,単品,ロング,,,,,,
2025/03/07 12:29:20,,新品同様/ユキトリイ YUKI TORII ワンピース 表記 38号 9号 M 相当 古着 紺 ネイビー レディース 春 秋 5分袖 絹混 毛混 ジャガード 膝丈,22000,-2200,0,0,新品同様,ユキトリイ,YUKI,TORII,ワンピース,表記,38号,9号,M,相当,古着,紺,ネイビー,レディース,春,秋,5分袖,絹混,毛混,ジャガード,膝丈,,
2025/03/06 14:47:31,,A美品/ ロペ ROPE 大人なオーバーブラウス 表記38号(Mサイズ相当) 紺/ネイビー ウール素材 オフィス 秋冬向け トップス レディース,5480,0,0,600,A美品,ロペ,ROPE,大人なオーバーブラウス,表記38号(Mサイズ相当),紺,ネイビー,ウール素材,オフィス,秋冬向け,トップス,レディース,,,,,,,,,,,
2025/03/04 12:07:24,,Ａ新品/詩仙堂 ヒトシタムラ 高級ちりめんロングベスト (9号/M相当) 緑/グリーン モダンデザイン 春秋向け トップス レディース,22810,-2281,0,0,Ａ新品,詩仙堂,ヒトシタムラ,高級ちりめんロングベスト,(9号,M相当),緑,グリーン,モダンデザイン,春秋向け,トップス,レディース,,,,,,,,,,,
2025/03/03 23:45:58,,新品/ローラアシュレイ LAURA ASHLEY ジャージワンピース 表記 11号 L 相当 紺 ネイビー 花柄 Vネック 七分袖 お出掛け 春 夏 レディース,20900,0,0,0,新品,ローラアシュレイ,LAURA,ASHLEY,ジャージワンピース,表記,11号,L,相当,紺,ネイビー,花柄,Vネック,七分袖,お出掛け,春,夏,レディース,,,,,
2025/03/03 08:27:12,,新品同様/エルミダ EL MIDAS 優雅フォーマルジャケット 表記10号(11号相当) 紺 フロッキー風 煌ラメ ノーカラー 毛絹混 春秋冬 レディース,20570,-2057,0,0,新品同様,エルミダ,EL,MIDAS,優雅フォーマルジャケット,表記10号(11号相当),紺,フロッキー風,煌ラメ,ノーカラー,毛絹混,春秋冬,レディース,,,,,,,,,,
2025/03/02 21:15:39,,美品/セオリーリュクス theory luxe ベスト 表記 38号 M 相当 黒 ブラック レディース 春 秋 トップス 毛100 ウール vネック 薄手 前開き,7700,0,0,600,美品,セオリーリュクス,theory,luxe,ベスト,表記,38号,M,相当,黒,ブラック,レディース,春,秋,トップス,毛100,ウール,vネック,薄手,前開き,,,
2025/03/01 23:30:08,,美品/トランスワーク TRANS WORK スカートスーツ イタリア製生地 11号 13号 茶 ブラウン レディース 春 秋 2点セット 毛100 ウール 薄手,15840,0,0,0,美品,トランスワーク,TRANS,WORK,スカートスーツ,イタリア製生地,11号,13号,茶,ブラウン,レディース,春,秋,2点セット,毛100,ウール,薄手,,,,,,
2025/03/01 05:05:35,,美品/フラジール FRAGILE フレアスカート 表記 38号 9号 M 相当 白黒 レディース 春 夏 ボトムス 薄手 ひざ丈 ストレッチ ジャージ素材,6600,0,0,600,美品,フラジール,FRAGILE,フレアスカート,表記,38号,9号,M,相当,白黒,レディース,春,夏,ボトムス,薄手,ひざ丈,ストレッチ,ジャージ素材,,,,,
2025/02/28 12:41:22,,M美品/ラルフローレン RALPH LAUREN ウール100%ニット 表記L号(11号/40号相当) グレー 定番シンプル 伸縮 長袖 秋冬 トップス レディース,7000,0,0,600,M美品,ラルフローレン,RALPH,LAUREN,ウール100%ニット,表記L号(11号,40号相当),グレー,定番シンプル,伸縮,長袖,秋冬,トップス,レディース,,,,,,,,,
2025/02/27 21:42:24,,美品/ジャンフランコフェレ GIANFRANCO FERRE すらっと美脚パンツ 小さいサイズ表記38号(７/S相当) グレー 伊製 春夏 ボトムス レディース,6300,0,0,600,美品,ジャンフランコフェレ,GIANFRANCO,FERRE,すらっと美脚パンツ,小さいサイズ表記38号(７,S相当),グレー,伊製,春夏,ボトムス,レディース,,,,,,,,,,,
2025/02/27 10:17:15,,M美品/タルボット Talbots 花柄フレアスカート 絹シルク100% 大きいサイズ 表記12号(13号〜15号相当) 黒 赤 春夏向け ボトムス レディース,4990,0,0,600,M美品,タルボット,Talbots,花柄フレアスカート,絹シルク100%,大きいサイズ,表記12号(13号〜15号相当),黒,赤,春夏向け,ボトムス,レディース,,,,,,,,,,,
2025/02/26 18:54:15,,美品/ボディドレッシングデラックス BODY DRESSING Deluxe タイトスカート 小さい 36号 S 相当 黒 ブラック レディース 秋 冬 ボトムス,7700,0,0,600,美品,ボディドレッシングデラックス,BODY,DRESSING,Deluxe,タイトスカート,小さい,36号,S,相当,黒,ブラック,レディース,秋,冬,ボトムス,,,,,,,
2025/02/25 15:04:10,,美品/Ebegcnce ニットカーディガン リバーシブル 表記 L 11号 相当 古着 茶 ブラウン オレンジ レディース 秋 冬 トップス 毛100 ウール,7700,0,0,600,美品,Ebegcnce,ニットカーディガン,リバーシブル,表記,L,11号,相当,古着,茶,ブラウン,オレンジ,レディース,秋,冬,トップス,毛100,ウール,,,,,
2025/02/25 14:50:28,,M新品同様/ボンシリエ BON CILIE 優雅ベロアジャケット 表記9号(M相当) 黒 透け感 プリーツ 薄手 フリル ラメ 春秋 アウター レディース,24900,-1000,0,0,M新品同様,ボンシリエ,BON,CILIE,優雅ベロアジャケット,表記9号(M相当),黒,透け感,プリーツ,薄手,フリル,ラメ,春秋,アウター,レディース,,,,,,,,
2025/02/24 00:03:49,,H美品/INDIVI インディヴィ 極柔ウールジャケット 小さいサイズ表記38号(7号相当) 黒/ブラック アンゴラ混 秋冬向け アウター レディース,12900,0,0,0,H美品,INDIVI,インディヴィ,極柔ウールジャケット,小さいサイズ表記38号(7号相当),黒,ブラック,アンゴラ混,秋冬向け,アウター,レディース,,,,,,,,,,,,
2025/02/21 00:09:51,,新品同様*SACRAサクラ*ふっくらツイード風*斜めレジメ柄*お洒落スカート38/9,5480,0,0,600,新品同様*SACRAサクラ*ふっくらツイード風*斜めレジメ柄*お洒落スカート38,9,,,,,,,,,,,,,,,,,,,,,
2025/02/19 15:46:21,,美品/バレンザ VALENZA ロングパンツ ストレッチ 大きいサイズ 表記 42号 LL 相当 古着 黒 ブラック レディース 秋 冬 ボトムス ビジュー,8690,0,0,600,美品,バレンザ,VALENZA,ロングパンツ,ストレッチ,大きいサイズ,表記,42号,LL,相当,古着,黒,ブラック,レディース,秋,冬,ボトムス,ビジュー,,,,,
2025/02/17 13:46:44,,M美品*スコッチハウス*渋色*プリーツスカート♪小さいサイズ36/7,5600,0,0,600,M美品*スコッチハウス*渋色*プリーツスカート♪小さいサイズ36,7,,,,,,,,,,,,,,,,,,,,,
2025/02/13 14:28:04,,美品/ミスクロエ Miss Chloe タイトスカート ツイード 表記 40号 11号 L 相当 古着 紺 ネイビー レディース 秋 冬 ボトムス 毛100 ウール,9020,0,0,600,美品,ミスクロエ,Miss,Chloe,タイトスカート,ツイード,表記,40号,11号,L,相当,古着,紺,ネイビー,レディース,秋,冬,ボトムス,毛100,ウール,,,
2025/02/12 18:57:43,,美品/ペニーブラック PENNY BLACK テーラードジャケット イタリア製 表記 40号 11号 相当 黒 ブラック ウール 秋 冬 アウター レディース,14850,0,0,0,美品,ペニーブラック,PENNY,BLACK,テーラードジャケット,イタリア製,表記,40号,11号,相当,黒,ブラック,ウール,秋,冬,アウター,レディース,,,,,,
2025/02/11 19:16:07,,美品/マックスマーラ MaxMara ウィークエンド WEEKEND 大人な美形ニットワンピース (11号/L相当) 黒 白 モダンな美柄 お出掛け 春秋向け,23650,0,0,0,美品,マックスマーラ,MaxMara,ウィークエンド,WEEKEND,大人な美形ニットワンピース,(11号,L相当),黒,白,モダンな美柄,お出掛け,春秋向け,,,,,,,,,,
2025/02/08 01:21:37,,美品/東京ソワール RIFANNE 大人ノーカラージャケット 大きいサイズ 表記15号(3L相当) オレンジ 美形 金釦 春秋冬向け アウター レディース,28600,0,0,0,美品,東京ソワール,RIFANNE,大人ノーカラージャケット,大きいサイズ,表記15号(3L相当),オレンジ,美形,金釦,春秋冬向け,アウター,レディース,,,,,,,,,,,
2025/02/07 10:49:43,,美品/オンワード樫山 ワンピース 表記 M 9号 38号 相当 古着 グレー レディース 秋 冬 ノーカラー シンプル ミモレ丈 長袖 ストレッチ,13640,0,0,0,美品,オンワード樫山,ワンピース,表記,M,9号,38号,相当,古着,グレー,レディース,秋,冬,ノーカラー,シンプル,ミモレ丈,長袖,ストレッチ,,,,,
2025/02/02 09:39:22,,新品/ignimoh's ブラックフォーマルワンピーススーツ 表記11号(L相当) 黒/ブラック レース 冠婚葬祭 喪服 春夏秋 セットアップ レディース,19800,0,0,0,新品,ignimoh's,ブラックフォーマルワンピーススーツ,表記11号(L相当),黒,ブラック,レース,冠婚葬祭,喪服,春夏秋,セットアップ,レディース,,,,,,,,,,,
2025/02/01 11:14:15,,美品/アリュード ALLUDE ニット セーター 小さいサイズ 表記 XS 7号 相当 ピンク レディース 秋冬 トップス ゆったり ウール カシミヤ 極柔,8470,-500,0,600,美品,アリュード,ALLUDE,ニット,セーター,小さいサイズ,表記,XS,7号,相当,ピンク,レディース,秋冬,トップス,ゆったり,ウール,カシミヤ,極柔,,,,,
2025/02/01 03:33:51,,Ａ美品/レキップ ヨシエイナバ L'EQUIPE YOSHIE INABA 美形ウールジャケット 表記40号(11号/L相当) 茶/ブラウン 秋冬 アウター レディース,12900,0,0,0,Ａ美品,レキップ,ヨシエイナバ,L'EQUIPE,YOSHIE,INABA,美形ウールジャケット,表記40号(11号,L相当),茶,ブラウン,秋冬,アウター,レディース,,,,,,,,,
2025/01/31 23:00:05,,M美品/組曲 KUMIKYOKU ツイード素材パンツ 表記2号(9号/38号/M相当) こげ茶 絹シルク混 ゆったり感 伸縮 秋冬向け ボトムス レディース,5200,0,0,600,M美品,組曲,KUMIKYOKU,ツイード素材パンツ,表記2号(9号,38号,M相当),こげ茶,絹シルク混,ゆったり感,伸縮,秋冬向け,ボトムス,レディース,,,,,,,,,
2025/01/27 20:31:37,,美品/三年坂 コート ちりめんコート 表記フリー 大きいサイズ 15号 17号相当 グレー 比翼 シンプル ふっくら 秋 冬 アウター レディース,22000,0,0,0,美品,三年坂,コート,ちりめんコート,表記フリー,大きいサイズ,15号,17号相当,グレー,比翼,シンプル,ふっくら,秋,冬,アウター,レディース,,,,,,,
2025/01/27 18:31:53,,美品/エイディーアデンダ ad addenda ダウンコート 大きいサイズ 表記 13号 LL 相当 ココアブラウン レディース 秋 冬 アウター ダウン90%,18480,0,0,0,美品,エイディーアデンダ,ad,addenda,ダウンコート,大きいサイズ,表記,13号,LL,相当,ココアブラウン,レディース,秋,冬,アウター,ダウン90%,,,,,,,
2025/01/27 09:21:39,,美品/ダーマコレクション DAMA collection ワイドパンツ 9号 M 相当 黒 ブラック レディース 秋 冬 ボトムス ゆったり シンプル ミモレ丈,7150,-2000,0,600,美品,ダーマコレクション,DAMA,collection,ワイドパンツ,9号,M,相当,黒,ブラック,レディース,秋,冬,ボトムス,ゆったり,シンプル,ミモレ丈,,,,,,
2025/01/27 00:27:57,,美品/クリッツィア KRIZIA ノーカラージャケット 大きい 表記 42号 13号 相当 ベージュ 毛 ウール 無地 ロゴ釦 秋 冬 アウター レディース,22880,0,0,0,美品,クリッツィア,KRIZIA,ノーカラージャケット,大きい,表記,42号,13号,相当,ベージュ,毛,ウール,無地,ロゴ釦,秋,冬,アウター,レディース,,,,,
2025/01/27 00:22:47,,M美品/Bowbell ちぐさボーベル 美形ジャケット 大きいサイズ13号(42号/LL相当) ピンク ウール100 格子柄 クラシカル 秋冬向け レディース,16000,0,0,0,M美品,Bowbell,ちぐさボーベル,美形ジャケット,大きいサイズ13号(42号,LL相当),ピンク,ウール100,格子柄,クラシカル,秋冬向け,レディース,,,,,,,,,,,
2025/01/26 11:24:07,,A美品/ 自由区 お洒落なワンピース 表記38号(9号相当) 黒/ブラック 艶感 麻リネン混 ミリタリー調デザイン 春夏向け レディース,5500,0,0,600,A美品,自由区,お洒落なワンピース,表記38号(9号相当),黒,ブラック,艶感,麻リネン混,ミリタリー調デザイン,春夏向け,レディース,,,,,,,,,,,,
2025/01/25 23:23:16,,A美品/ コントワーデコトニエ COMPTOIR DES COTONNIERS フレアスカート 表記38号(9号/M相当) 茶/ブラウン 麻リネン100％ 春夏 ボトムス,5500,-500,0,600,A美品,コントワーデコトニエ,COMPTOIR,DES,COTONNIERS,フレアスカート,表記38号(9号,M相当),茶,ブラウン,麻リネン100％,春夏,ボトムス,,,,,,,,,,
2025/01/20 00:24:58,,A新品同様/ダジュール D'azur 大人フレアスカート (11号/Lサイズ相当) 黒 ブラック プリーツデザイン 高級ベロア素材 秋冬 ボトムス,9801,0,0,600,A新品同様,ダジュール,D'azur,大人フレアスカート,(11号,Lサイズ相当),黒,ブラック,プリーツデザイン,高級ベロア素材,秋冬,ボトムス,,,,,,,,,,,
2025/01/19 09:19:12,,美品/ハロッズ Harrods ポンチョコート 表記 2号 9号 M 相当 古着 ベージュ レディース 秋 冬 アウター アンゴラ 毛 ウール 羽織り 可愛い,11000,0,0,0,美品,ハロッズ,Harrods,ポンチョコート,表記,2号,9号,M,相当,古着,ベージュ,レディース,秋,冬,アウター,アンゴラ,毛,ウール,羽織り,可愛い,,,
2025/01/17 22:19:24,,S美品【ヒロココシノ】濃茶*伸縮♪美ドレープ♪美的チュニック9,6199,0,0,600,S美品【ヒロココシノ】濃茶*伸縮♪美ドレープ♪美的チュニック9,,,,,,,,,,,,,,,,,,,,,,
2025/01/16 21:59:03,,Ａ新品同様/チヴィディーニ CIVIDINI タートルニットワンピース 極柔カシミヤ 表記42号(9号/Ｍ相当) グレー ベージュ 大人モダン柄 秋冬,24900,0,0,0,Ａ新品同様,チヴィディーニ,CIVIDINI,タートルニットワンピース,極柔カシミヤ,表記42号(9号,Ｍ相当),グレー,ベージュ,大人モダン柄,秋冬,,,,,,,,,,,,
2025/01/15 08:46:54,,新品同様/ヒロコビス HIROKO BIS ベスト 表記 11号 L 相当 茶 こげ茶 立体格子柄 薄手 伸縮 前開き ハーフ丈 春秋 トップス レディース,13750,0,0,0,新品同様,ヒロコビス,HIROKO,BIS,ベスト,表記,11号,L,相当,茶,こげ茶,立体格子柄,薄手,伸縮,前開き,ハーフ丈,春秋,トップス,レディース,,,,
2025/01/15 07:27:21,,セール★美品*ZARAサラ*茶*フェイクレザー*異素材ワンピース*小さいサイズS/7,4210,0,0,0,セール★美品*ZARAサラ*茶*フェイクレザー*異素材ワンピース*小さいサイズS,7,,,,,,,,,,,,,,,,,,,,,
2025/01/13 18:20:47,,新品同様/ランバンノワール LANVIN NOIR ブラックフォーマルワンピーススーツ 表記 40号 L 11号 相当 黒 レディース 冠婚葬祭 サテン,38170,-1500,0,0,新品同様,ランバンノワール,LANVIN,NOIR,ブラックフォーマルワンピーススーツ,表記,40号,L,11号,相当,黒,レディース,冠婚葬祭,サテン,,,,,,,,,
2025/01/09 16:33:07,,美品/ボナジョルナータ BUONA GIORNATA ニットチュニック 表記 F 9号〜11号 相当 赤 レッド ノルディック柄 秋冬 トップス レディース,11000,0,0,0,美品,ボナジョルナータ,BUONA,GIORNATA,ニットチュニック,表記,F,9号〜11号,相当,赤,レッド,ノルディック柄,秋冬,トップス,レディース,,,,,,,,
2025/01/06 22:15:47,,H美品/ニューヨーカー NEW YORKER 美形大人スカート 表記9号(Mサイズ相当) 水色 春夏向け 綿混 お出掛け ランチ会 ボトムス レディース,4990,0,0,600,H美品,ニューヨーカー,NEW,YORKER,美形大人スカート,表記9号(Mサイズ相当),水色,春夏向け,綿混,お出掛け,ランチ会,ボトムス,レディース,,,,,,,,,,
