OrderTime,SubCode,Title,UnitPrice,TotalMallCouponDiscount,UsePoint,ShipCharge,Title_1,Title_2,Title_3,Title_4,Title_5,Title_6,Title_7,Title_8,Title_9,Title_10,Title_11,Title_12,Title_13,Title_14,Title_15,Title_16,Title_17,Title_18,Title_19,Title_20,Title_21,Title_22,Title_23
2024/09/30 02:53:43,,美品/ガウディ GAUDI スキニーパンツ 小さいサイズ 表記 28号 S 相当 黒 ブラック レディース 春 夏 ボトムス 綿混 コットン ストレッチ,7920,0,0,600,美品,ガウディ,GAUDI,スキニーパンツ,小さいサイズ,表記,28号,S,相当,黒,ブラック,レディース,春,夏,ボトムス,綿混,コットン,ストレッチ,,,,,
2024/09/29 22:24:29,,S美品 ザラ ZARA お洒落美脚ロングパンツ 11号/Lサイズ 白×黒 チェック柄 ボトムス レディース,2995,0,0,600,S美品,ザラ,ZARA,お洒落美脚ロングパンツ,11号,Lサイズ,白×黒,チェック柄,ボトムス,レディース,,,,,,,,,,,,,
2024/09/29 15:24:21,,レキシオ 特製プレイマット 韓国 ボードゲーム 牌ボードゲーム 麻雀 ポーカー 大富豪 Lexio レキシオネオ LexioNeo アナログゲーム 送料無料 パーティー 2〜5人,4980,0,0,600,レキシオ,特製プレイマット,韓国,ボードゲーム,牌ボードゲーム,麻雀,ポーカー,大富豪,Lexio,レキシオネオ,LexioNeo,アナログゲーム,送料無料,パーティー,2〜5人,,,,,,,,
2024/09/29 09:26:55,,美品/グレースコンチネンタル GRACE CONTINENTAL 輝きパールジャケット 小さい 表記36号(７号相当) ベージュ 春秋向け アウター レディース,30000,-1500,0,0,美品,グレースコンチネンタル,GRACE,CONTINENTAL,輝きパールジャケット,小さい,表記36号(７号相当),ベージュ,春秋向け,アウター,レディース,,,,,,,,,,,,
2024/09/29 00:27:34,,美品/ヨシエイナバ L'EQUIPE YOSHIE INABA チェック柄フレアスカート 表記9号(Mサイズ相当) 緑/グリーン 春夏向け ボトムス レディース,5500,0,0,600,美品,ヨシエイナバ,L'EQUIPE,YOSHIE,INABA,チェック柄フレアスカート,表記9号(Mサイズ相当),緑,グリーン,春夏向け,ボトムス,レディース,,,,,,,,,,,
2024/09/28 23:40:31,,美品/ピエールバルマン PIERRE BALMAIN 異素材ジャケット 表記B/F/E42号(大きい13号相当) 黒/ブラック ベロア 秋冬向 アウター レディース,16830,-1683,0,0,美品,ピエールバルマン,PIERRE,BALMAIN,異素材ジャケット,表記B,F,E42号(大きい13号相当),黒,ブラック,ベロア,秋冬向,アウター,レディース,,,,,,,,,
2024/09/25 21:14:32,,美品/ロベルタ ディ カメリーノ Roberta di Camerin ニットワンピース 表記 9号 38号 相当 茶 ブラウン ロゴ お出掛け 春 秋 レディース,20130,0,0,0,美品,ロベルタ,ディ,カメリーノ,Roberta,di,Camerin,ニットワンピース,表記,9号,38号,相当,茶,ブラウン,ロゴ,お出掛け,春,秋,レディース,,,,
2024/09/25 13:11:10,,美品/シビラ Sybilla カーディガン 小さいサイズ 表記 SS 5号 相当 ベージュ レディース 春 夏 トップス Vネック レース 綿100 コットン,8690,-300,0,600,美品,シビラ,Sybilla,カーディガン,小さいサイズ,表記,SS,5号,相当,ベージュ,レディース,春,夏,トップス,Vネック,レース,綿100,コットン,,,,,
2024/09/23 17:01:56,,美品/ビースリー B3 ストレッチパンツ 小さい 表記 30号 7号 相当 黒 ブラック 伸縮性 無地 ロゴ釦 お出掛け 春夏秋 ボトムス レディース,6600,0,0,600,美品,ビースリー,B3,ストレッチパンツ,小さい,表記,30号,7号,相当,黒,ブラック,伸縮性,無地,ロゴ釦,お出掛け,春夏秋,ボトムス,レディース,,,,,
2024/09/23 06:42:12,,美品/レリアン Leilian カーディガン 大きいサイズ 表記 13号 LL 相当 黒 ブラック レディース 春 秋冬 トップス 長袖 絹 シルク 毛 ウール,14520,0,990,0,美品,レリアン,Leilian,カーディガン,大きいサイズ,表記,13号,LL,相当,黒,ブラック,レディース,春,秋冬,トップス,長袖,絹,シルク,毛,ウール,,,
2024/09/22 12:11:59,,M新品同様/レリアン Leilian 美編ニットカーディガン 表記9号(38号/M相当) 紫/パープル 絹シルク100% 長袖 春夏秋向け トップス レディース,22810,-4000,0,0,M新品同様,レリアン,Leilian,美編ニットカーディガン,表記9号(38号,M相当),紫,パープル,絹シルク100%,長袖,春夏秋向け,トップス,レディース,,,,,,,,,,
2024/09/22 12:11:59,,新品同様/レリアン Leilian テーラードジャケット 表記 9号 M 相当 ベージュ 花柄 羽織り ロング丈 薄手 軽やか 春 夏 アウター レディース,28930,-4000,0,0,新品同様,レリアン,Leilian,テーラードジャケット,表記,9号,M,相当,ベージュ,花柄,羽織り,ロング丈,薄手,軽やか,春,夏,アウター,レディース,,,,,
2024/09/16 23:46:52,,A美品/theory/セオリー/綿コットン100％/爽やか長袖ブラウス/大きいサイズ/11号〜13号相当/春夏秋/トップス/レディース,12800,0,0,0,A美品,theory,セオリー,綿コットン100％,爽やか長袖ブラウス,大きいサイズ,11号〜13号相当,春夏秋,トップス,レディース,,,,,,,,,,,,,
2024/09/16 23:46:52,,H美品/ INDIVI インディヴィ ふっくら柔らかニットセーター 表記38号(Mサイズ相当) 黒/ブラック 秋冬向け ウール混 トップス レディース,5500,0,0,0,H美品,INDIVI,インディヴィ,ふっくら柔らかニットセーター,表記38号(Mサイズ相当),黒,ブラック,秋冬向け,ウール混,トップス,レディース,,,,,,,,,,,,
2024/09/16 23:46:52,,H美品/LOLO Collection ロロコレクション 美形ジャケット 大きいサイズ表記42号(13号LL相当) グレー 秋冬向 ツイード アウター レディース,5500,0,0,0,H美品,LOLO,Collection,ロロコレクション,美形ジャケット,大きいサイズ表記42号(13号LL相当),グレー,秋冬向,ツイード,アウター,レディース,,,,,,,,,,,,
2024/09/16 14:29:22,,美品/伊太利屋 GK 中綿入りベスト 表記 11号 L 相当 茶 ブラウン ヒョウ柄 ワッペン 軽やか おしゃれ お出掛け 秋 冬 トップス レディース,21230,0,0,0,美品,伊太利屋,GK,中綿入りベスト,表記,11号,L,相当,茶,ブラウン,ヒョウ柄,ワッペン,軽やか,おしゃれ,お出掛け,秋,冬,トップス,レディース,,,,
2024/09/15 11:58:16,,Ａ美品/トゥービーシック TO BE CHIC 美揺れフレアスカート 表記42号(9号/M相当) 青/ブルー デニム素材 プリーツデザイン 春夏 ボトムス,14900,0,0,0,Ａ美品,トゥービーシック,TO,BE,CHIC,美揺れフレアスカート,表記42号(9号,M相当),青,ブルー,デニム素材,プリーツデザイン,春夏,ボトムス,,,,,,,,,
2024/09/13 21:22:29,,美品/エスプリ ESPRIT テーラードジャケット 小さいサイズ 表記I38 D34 S 7号相当 紫 藤色 シンプル ストレッチ 秋 冬 アウター レディース,16830,0,0,0,美品,エスプリ,ESPRIT,テーラードジャケット,小さいサイズ,表記I38,D34,S,7号相当,紫,藤色,シンプル,ストレッチ,秋,冬,アウター,レディース,,,,,,
2024/09/13 12:39:46,,美品/レキップ ヨシエイナバ L'EQUIPE YOSHIE INABA デニムジャケット 表記 11号 L 相当 古着 濃紺 レディース 春 秋 アウター 長袖 綿,15290,0,0,0,美品,レキップ,ヨシエイナバ,L'EQUIPE,YOSHIE,INABA,デニムジャケット,表記,11号,L,相当,古着,濃紺,レディース,春,秋,アウター,長袖,綿,,,,
2024/09/11 15:37:45,,A美品*Paul Smith*ポールスミス*ロゴ釦*美脚デニムパンツ38/9,4110,0,0,600,A美品*Paul,Smith*ポールスミス*ロゴ釦*美脚デニムパンツ38,9,,,,,,,,,,,,,,,,,,,,
2024/09/09 09:37:45,,A美品/22 OCTOBRE/22オクトーブル/グレー/艶感/微小幾何学柄/煌びやかラメ/素敵スカートスーツ/38号(9号*M相当)秋冬/レディース,12800,0,0,0,A美品,22,OCTOBRE,22オクトーブル,グレー,艶感,微小幾何学柄,煌びやかラメ,素敵スカートスーツ,38号(9号*M相当)秋冬,レディース,,,,,,,,,,,,
2024/09/08 19:15:28,,新品同様/mimosalip カーディガン 総レース 表記 M〜L 9号 11号 相当 古着 黒 ブラック レディース 春 夏 トップス 長袖 透け感 シースルー,8360,0,0,600,新品同様,mimosalip,カーディガン,総レース,表記,M〜L,9号,11号,相当,古着,黒,ブラック,レディース,春,夏,トップス,長袖,透け感,シースルー,,,,
2024/09/07 22:39:13,,A新品同様/ インソレンテ insolente 素敵チュニック 表記 M〜L(9号/11号) 青/黒 伸縮性素材 フランス製 モダン美柄 春夏 トップス,9799,0,0,600,A新品同様,インソレンテ,insolente,素敵チュニック,表記,M〜L(9号,11号),青,黒,伸縮性素材,フランス製,モダン美柄,春夏,トップス,,,,,,,,,
2024/09/07 21:29:15,,美品/プライドグライド prideglide ラップスカート ミニスカート 小さいサイズ 表記 36号 S 相当 グレー 毛100 レディース 秋 冬 ボトムス,11770,0,0,0,美品,プライドグライド,prideglide,ラップスカート,ミニスカート,小さいサイズ,表記,36号,S,相当,グレー,毛100,レディース,秋,冬,ボトムス,,,,,,,
2024/09/07 20:20:52,,H美品/smart pink スマートピンク モダン柄ストレッチチュニック 表記40号(11号Lサイズ相当) 茶/緑/ブラウン 春夏向け トップス レディース,12800,0,0,0,H美品,smart,pink,スマートピンク,モダン柄ストレッチチュニック,表記40号(11号Lサイズ相当),茶,緑,ブラウン,春夏向け,トップス,レディース,,,,,,,,,,,
2024/09/05 21:05:47,,Ａ美品/ピンキー&ダイアン Pinky&Dianne 大人なフリルブラウス 表記38号(9号/M相当) 黒/ブラック お食事会 春夏向け トップス レディース,4110,0,0,600,Ａ美品,ピンキー&ダイアン,Pinky&Dianne,大人なフリルブラウス,表記38号(9号,M相当),黒,ブラック,お食事会,春夏向け,トップス,レディース,,,,,,,,,,,
2024/09/05 03:18:51,,M美品/ダナキャラン DKNY イタリア製スカートスーツ 表記I42 I44(9号/M〜11号/L相当) アイボリー 絹シルク&綿コットン素材 春秋 レディース,15899,0,0,0,M美品,ダナキャラン,DKNY,イタリア製スカートスーツ,表記I42,I44(9号,M〜11号,L相当),アイボリー,絹シルク&綿コットン素材,春秋,レディース,,,,,,,,,,,
2024/09/01 17:40:00,,Ａ美品/伊太利屋 ジップアップニットカーディガン 表記9号(M相当) 白 黒 グレー アンゴラ混 トナカイ 秋冬向け トップス レディース,12800,0,0,0,Ａ美品,伊太利屋,ジップアップニットカーディガン,表記9号(M相当),白,黒,グレー,アンゴラ混,トナカイ,秋冬向け,トップス,レディース,,,,,,,,,,,
2024/08/29 23:59:20,,美品/ユキコハナイ yukiko hanai フレアスカート 表記 8号 9号 相当 黒 ブラック ダマスク柄 艶感 高級感 春 秋 ボトムス レディース,11000,0,0,0,美品,ユキコハナイ,yukiko,hanai,フレアスカート,表記,8号,9号,相当,黒,ブラック,ダマスク柄,艶感,高級感,春,秋,ボトムス,レディース,,,,,
2024/08/29 22:12:51,,Ａ美品/レリアン Leilian 上品な美形ジャケット 大きいサイズ 表記13号(LLサイズ相当) フランス製生地 繊細な美柄デザイン 秋冬 アウター,42801,0,0,0,Ａ美品,レリアン,Leilian,上品な美形ジャケット,大きいサイズ,表記13号(LLサイズ相当),フランス製生地,繊細な美柄デザイン,秋冬,アウター,,,,,,,,,,,,,
2024/08/24 19:39:07,,A新品同様*コムサデモード*グレー*ボックスプリーツスカート11,5000,0,0,600,A新品同様*コムサデモード*グレー*ボックスプリーツスカート11,,,,,,,,,,,,,,,,,,,,,,
2024/08/22 22:21:49,,美品/ビースリー B-Three B3 ロングパンツ 表記 32号 9号 M 相当 キャメル系 レディース 春 秋 冬 ボトムス 綿混 コットン ストレッチ,6600,0,300,600,美品,ビースリー,B-Three,B3,ロングパンツ,表記,32号,9号,M,相当,キャメル系,レディース,春,秋,冬,ボトムス,綿混,コットン,ストレッチ,,,,
2024/08/19 17:10:33,,Ａ美品/ジュンアシダ jun ashida 大人な美的スカートスーツ 表記11号(L相当) ピンク 絹シルク ヘリンボーン柄 パーティー 春秋 レディース,24800,0,0,0,Ａ美品,ジュンアシダ,jun,ashida,大人な美的スカートスーツ,表記11号(L相当),ピンク,絹シルク,ヘリンボーン柄,パーティー,春秋,レディース,,,,,,,,,,,
2024/08/19 15:02:04,,新品同様/ソニアバレンシア SONIA BALENCIA ブラックフォーマルワンピース 表記 9AR M 相当 黒 ブラック 2P風 冠婚葬祭 春夏 レディース,17930,-1500,0,0,新品同様,ソニアバレンシア,SONIA,BALENCIA,ブラックフォーマルワンピース,表記,9AR,M,相当,黒,ブラック,2P風,冠婚葬祭,春夏,レディース,,,,,,,,
2024/08/12 19:16:21,,美品/ビースリー B3 B-three デニムパンツ 表記 34号 11号 相当 白 ホワイト ストレッチ性 シンプル お出掛け 春 秋 ボトムス レディース,7700,0,0,600,美品,ビースリー,B3,B-three,デニムパンツ,表記,34号,11号,相当,白,ホワイト,ストレッチ性,シンプル,お出掛け,春,秋,ボトムス,レディース,,,,,
2024/08/11 19:26:47,,Ａ新品/ダーマコレクション DAMA collection 涼しげな美脚パンツ (11号/L相当) グレー 麻リネン100％ 春夏向け ボトムス レディース,5500,-3000,0,600,Ａ新品,ダーマコレクション,DAMA,collection,涼しげな美脚パンツ,(11号,L相当),グレー,麻リネン100％,春夏向け,ボトムス,レディース,,,,,,,,,,,
2024/08/10 16:05:27,,新品/ポートランド PORT LAND ラップスカート 巻きスカート 表記 3号 11号 L 相当 紺 ネイビー レディース 春 夏 綿混 前開き シンプル,7700,0,0,600,新品,ポートランド,PORT,LAND,ラップスカート,巻きスカート,表記,3号,11号,L,相当,紺,ネイビー,レディース,春,夏,綿混,前開き,シンプル,,,,
2024/08/09 22:41:38,,美品/ユナイテッドカラーズオブベネトン BENETTON 麻リネン100％ワンピース イタリア製 表記M(9号相当) 黒/ブラック 春夏向け レディース,8470,0,0,600,美品,ユナイテッドカラーズオブベネトン,BENETTON,麻リネン100％ワンピース,イタリア製,表記M(9号相当),黒,ブラック,春夏向け,レディース,,,,,,,,,,,,,
2024/08/07 12:28:47,,新品同様/レリアン Leilian 美柄シフォンカットソー 表記11号(Lサイズ相当) ピンク系 ペーズリー柄 春夏向け トップス レディース,6790,0,0,600,新品同様,レリアン,Leilian,美柄シフォンカットソー,表記11号(Lサイズ相当),ピンク系,ペーズリー柄,春夏向け,トップス,レディース,,,,,,,,,,,,,
2024/07/31 00:10:23,,新品同様/伊太利屋 アニマル柄お洒落ジャケット 表記7号(11号/Lサイズ相当) 茶/ブラウン 春秋冬向け アウター レディース,24900,0,0,0,新品同様,伊太利屋,アニマル柄お洒落ジャケット,表記7号(11号,Lサイズ相当),茶,ブラウン,春秋冬向け,アウター,レディース,,,,,,,,,,,,,
2024/07/25 19:10:05,,M美品/スキャパ SCAPA 上品ツイードジャケット 表記40号(11号/L相当) ベージュ 綿&麻リネン混 ノーカラー 春秋向け アウター レディース,12900,0,0,0,M美品,スキャパ,SCAPA,上品ツイードジャケット,表記40号(11号,L相当),ベージュ,綿&麻リネン混,ノーカラー,春秋向け,アウター,レディース,,,,,,,,,,,
2024/07/24 21:22:46,,新品同様/東京ソワール TOKYO SOIR フォーマルスカート 表記11号 L相当 黒 ブラック レディース 春 夏 ボトムス プリーツ加工 シフォン,18590,0,0,0,新品同様,東京ソワール,TOKYO,SOIR,フォーマルスカート,表記11号,L相当,黒,ブラック,レディース,春,夏,ボトムス,プリーツ加工,シフォン,,,,,,,,
2024/07/24 04:35:06,,H新品同様/メルローズ MELROSE 美形ノースリーブカットソー (9号Mサイズ相当) 黒/ブラック/白 春夏向け モノトーン トップス レディース,3950,0,0,600,H新品同様,メルローズ,MELROSE,美形ノースリーブカットソー,(9号Mサイズ相当),黒,ブラック,白,春夏向け,モノトーン,トップス,レディース,,,,,,,,,,,
2024/07/21 18:20:55,,Ａ美品/ユナイテッドカラーズオブベネトン UNITED COLORS OF BENETTON デニムスカート 小さめ 表記40号(7号相当) ブルー ボトムス 春秋向け,5600,0,0,600,Ａ美品,ユナイテッドカラーズオブベネトン,UNITED,COLORS,OF,BENETTON,デニムスカート,小さめ,表記40号(7号相当),ブルー,ボトムス,春秋向け,,,,,,,,,,,
2024/07/19 10:31:33,,美品/ユキトリイ YUKI TORII フリルカーディガン 表記 L 11号 相当 白 ホワイト プリーツ 薄手 七分袖 ハーフ丈 春 夏 トップス レディース,17050,0,0,0,美品,ユキトリイ,YUKI,TORII,フリルカーディガン,表記,L,11号,相当,白,ホワイト,プリーツ,薄手,七分袖,ハーフ丈,春,夏,トップス,レディース,,,,
2024/07/18 05:38:41,,新品同様/マンゴ MANGO 清楚ノーカラージャケット 大きいサイズ 表記USA/L(LL相当) 白/ホワイト 羽織 シンプル 春夏秋 アウター レディース,19800,0,0,0,新品同様,マンゴ,MANGO,清楚ノーカラージャケット,大きいサイズ,表記USA,L(LL相当),白,ホワイト,羽織,シンプル,春夏秋,アウター,レディース,,,,,,,,,
2024/07/18 05:35:44,,美品/タルボット TALBOTS フレアスカート 大きいサイズ 表記 10号 13号 相当 古着 白 レディース 春 夏 綿100 コットン カットワークレース,13750,0,0,0,美品,タルボット,TALBOTS,フレアスカート,大きいサイズ,表記,10号,13号,相当,古着,白,レディース,春,夏,綿100,コットン,カットワークレース,,,,,,
2024/07/17 16:41:14,,A美品/ヴィヴィアンタム VIVIENNE TAM 素敵フレアスカート 小さいサイズ表記0号(5号相当) 茶/ブラウン 高級な羊革 秋冬向け ボトムス,12800,0,0,0,A美品,ヴィヴィアンタム,VIVIENNE,TAM,素敵フレアスカート,小さいサイズ表記0号(5号相当),茶,ブラウン,高級な羊革,秋冬向け,ボトムス,,,,,,,,,,,,
2024/07/17 10:25:35,,美品/トランスワーク TRANS WORK チュニック 大きい 表記 44号 3L 相当 アイボリー系 レディース 春夏 トップス シフォン 長袖 薄手 透け感,7920,-792,0,600,美品,トランスワーク,TRANS,WORK,チュニック,大きい,表記,44号,3L,相当,アイボリー系,レディース,春夏,トップス,シフォン,長袖,薄手,透け感,,,,,
2024/07/17 09:51:54,,M新品同様/東京スタイル BISTY 立体美柄カーディガン 表記M号(9号/38号相当) 黒/ブラック 透け感 7分袖 伸縮 春夏向け トップス レディース,5600,-300,0,600,M新品同様,東京スタイル,BISTY,立体美柄カーディガン,表記M号(9号,38号相当),黒,ブラック,透け感,7分袖,伸縮,春夏向け,トップス,レディース,,,,,,,,,
2024/07/13 15:17:51,,美品/ハナエモリ HANAE MORI ブラウス 大きい 表記 44号 15号 相当 緑 青 ボタニカル柄 半袖 お出掛け 春 夏 トップス レディース,9350,0,0,600,美品,ハナエモリ,HANAE,MORI,ブラウス,大きい,表記,44号,15号,相当,緑,青,ボタニカル柄,半袖,お出掛け,春,夏,トップス,レディース,,,,
2024/07/12 08:19:55,,新品同様/スーナウーナ sunauna 大判花柄スカート 表記40号(11号/L相当) 紺/ネイビー 軽やか素材 薄地 膝丈 春夏向け ボトムス レディース,8360,0,3,600,新品同様,スーナウーナ,sunauna,大判花柄スカート,表記40号(11号,L相当),紺,ネイビー,軽やか素材,薄地,膝丈,春夏向け,ボトムス,レディース,,,,,,,,,
2024/07/10 14:48:25,,Ａ美品/ダイアンフォンファステンバーグ DIANE VON FURSTENBERG ラップチュニック 小さめ 表記6号(7号相当) 青 黒 美柄デザイン 春夏,22000,0,0,0,Ａ美品,ダイアンフォンファステンバーグ,DIANE,VON,FURSTENBERG,ラップチュニック,小さめ,表記6号(7号相当),青,黒,美柄デザイン,春夏,,,,,,,,,,,
2024/07/10 08:58:58,,A美品/エフデ ef-de 大人フレアスカート 小さいサイズ 表記５号(XS相当) 黒 ブラック 繊細プリーツ お出掛け パーティ 秋冬 ボトムス,6199,0,0,0,A美品,エフデ,ef-de,大人フレアスカート,小さいサイズ,表記５号(XS相当),黒,ブラック,繊細プリーツ,お出掛け,パーティ,秋冬,ボトムス,,,,,,,,,,
2024/07/10 08:58:58,,A新品同様/インディヴィ INDIVI 美的タイトスカート 小さいサイズ 表記５号(XS相当)黒 ブラック 3段ピンタック ウール100％ 秋冬 ボトムス,7799,0,0,0,A新品同様,インディヴィ,INDIVI,美的タイトスカート,小さいサイズ,表記５号(XS相当)黒,ブラック,3段ピンタック,ウール100％,秋冬,ボトムス,,,,,,,,,,,,
2024/07/09 10:25:39,,美品/ケーティーリノ K.T LINO 美形ジャケット 表記11号(40号/L相当) 黒/ブラック 麻リネン素材 7分袖 薄地 春夏向け アウター レディース,13200,0,0,0,美品,ケーティーリノ,K.T,LINO,美形ジャケット,表記11号(40号,L相当),黒,ブラック,麻リネン素材,7分袖,薄地,春夏向け,アウター,レディース,,,,,,,,
2024/07/07 07:51:56,,新品/PERUVIAN CONNECTION 花柄ワンピース 表記M(11号/大きいサイズ 13号相当) ベージュ 多彩 ジャージ素材 伸縮 長袖 春夏向け レディース,11000,0,0,0,新品,PERUVIAN,CONNECTION,花柄ワンピース,表記M(11号,大きいサイズ,13号相当),ベージュ,多彩,ジャージ素材,伸縮,長袖,春夏向け,レディース,,,,,,,,,
2024/07/07 01:13:37,,美品/詩仙堂 ヒトシタムラ クロップドパンツ 表記 9号 M 相当 黒 ブラック ちりめん素材 大人 上品 お出掛け 春 夏 ボトムス レディース,15730,-2000,0,0,美品,詩仙堂,ヒトシタムラ,クロップドパンツ,表記,9号,M,相当,黒,ブラック,ちりめん素材,大人,上品,お出掛け,春,夏,ボトムス,レディース,,,,,
2024/07/03 00:23:05,,M【シーバイクロエ】伊製♪黒*コットン100*素敵ハーフパンツ*I40,6799,0,0,600,M【シーバイクロエ】伊製♪黒*コットン100*素敵ハーフパンツ*I40,,,,,,,,,,,,,,,,,,,,,,
2024/07/02 21:01:24,,レキシオネオ LexioNeo 韓国 ボードゲーム 牌ボードゲーム 麻雀 ポーカー 大富豪 Lexio レキシオ レキシオプラス アナログゲーム 送料無料 パーティー 2〜5人,12001,0,1054,0,レキシオネオ,LexioNeo,韓国,ボードゲーム,牌ボードゲーム,麻雀,ポーカー,大富豪,Lexio,レキシオ,レキシオプラス,アナログゲーム,送料無料,パーティー,2〜5人,,,,,,,,
2024/07/01 21:34:05,,美品*伊太利屋*藍色*耀きレオパード*お洒落ジャージワンピース9,6800,0,0,600,美品*伊太利屋*藍色*耀きレオパード*お洒落ジャージワンピース9,,,,,,,,,,,,,,,,,,,,,,
2024/07/01 19:00:03,,新品同様/アンタイトル UNTITLED ガウチョパンツ 小さいサイズ 表記1号 S相当 グレー ワイド ゆったり 薄手 春 夏 秋 ボトムス レディース,7480,0,0,0,新品同様,アンタイトル,UNTITLED,ガウチョパンツ,小さいサイズ,表記1号,S相当,グレー,ワイド,ゆったり,薄手,春,夏,秋,ボトムス,レディース,,,,,,,
2024/07/01 19:00:03,,美品/スマートピンク smart pink フレアスカート 表記 40号 M 相当 古着 グレー系 レディース 春 夏 ボトムス 薄手 ストレッチ ミモレ丈,7370,0,0,0,美品,スマートピンク,smart,pink,フレアスカート,表記,40号,M,相当,古着,グレー系,レディース,春,夏,ボトムス,薄手,ストレッチ,ミモレ丈,,,,,
2024/07/01 17:34:18,,美品/コムサ COMME CA タイトスカート デニム 表記 11号 L 相当 ベージュ レディース 春 夏 秋 冬 ミモレ丈 ボトムス シンプル 綿 コットン,5500,-111,0,600,美品,コムサ,COMME,CA,タイトスカート,デニム,表記,11号,L,相当,ベージュ,レディース,春,夏,秋,冬,ミモレ丈,ボトムス,シンプル,綿,コットン,,
2024/06/30 14:35:54,,新品/VINCI チェスターコート イタリア製 9号/M相当 炭黒系 濃グレー ウール素材 モヘア混 シンプル ロング 秋冬向け アウター レディース,26400,0,0,0,新品,VINCI,チェスターコート,イタリア製,9号,M相当,炭黒系,濃グレー,ウール素材,モヘア混,シンプル,ロング,秋冬向け,アウター,レディース,,,,,,,,
2024/06/30 03:47:44,,A新品*エムフィル×ユナイテッドアローズ/ボーダー柄/お洒落ツイードパンツ40/11,6790,0,0,600,A新品*エムフィル×ユナイテッドアローズ,ボーダー柄,お洒落ツイードパンツ40,11,,,,,,,,,,,,,,,,,,,
