OrderTime,SubCode,Title,UnitPrice,TotalMallCouponDiscount,UsePoint,ShipCharge,Title_1,Title_2,Title_3,Title_4,Title_5,Title_6,Title_7,Title_8,Title_9,Title_10,Title_11,Title_12,Title_13,Title_14,Title_15,Title_16,Title_17,Title_18,Title_19,Title_20,Title_21,Title_22,Title_23
2025/01/03 11:48:44,,M新品同様/ローラアシュレイ LAURA ASHLEY ふっくらニット 小さいサイズ 表記S号(7号相当) ベージュ 毛&絹素材 秋冬向 トップス レディース,6210,0,0,600,M新品同様,ローラアシュレイ,LAURA,ASHLEY,ふっくらニット,小さいサイズ,表記S号(7号相当),ベージュ,毛&絹素材,秋冬向,トップス,レディース,,,,,,,,,,,
2025/01/02 00:25:03,,美品/ビースリー B3 美脚デニムパンツ 表記38号(9号相当) 黒/ブラック ロゴ釦 ストレッチ性 お出掛け 春秋 ボトムス レディース,7700,0,0,600,美品,ビースリー,B3,美脚デニムパンツ,表記38号(9号相当),黒,ブラック,ロゴ釦,ストレッチ性,お出掛け,春秋,ボトムス,レディース,,,,,,,,,,
2025/01/01 21:54:26,,A美品*Lilidia*リリディア*黒*リブ編み*ふっくらニットワンピース*小さいサイズ1/7,6985,0,0,600,A美品*Lilidia*リリディア*黒*リブ編み*ふっくらニットワンピース*小さいサイズ1,7,,,,,,,,,,,,,,,,,,,,,
2025/01/01 20:48:57,,美品/インディヴィ INDIVI 令嬢ワンピース 表記38号(9号/M相当) 茶/ブラウン 繊細ツイード素材 毛ウール混 2分袖 秋冬向け レディース,15180,0,0,0,美品,インディヴィ,INDIVI,令嬢ワンピース,表記38号(9号,M相当),茶,ブラウン,繊細ツイード素材,毛ウール混,2分袖,秋冬向け,レディース,,,,,,,,,,
2025/01/01 10:55:10,,美品/フェミニン Feminine 東京ブラウス カットソー 総レース 9号 M 相当 古着 ピンク レディース 春 夏 トップス 長袖 透け感 エレガント,8800,0,0,600,美品,フェミニン,Feminine,東京ブラウス,カットソー,総レース,9号,M,相当,古着,ピンク,レディース,春,夏,トップス,長袖,透け感,エレガント,,,,,
2024/12/28 10:53:13,,美品/伊太利屋 GK クラシカルスカートスーツ 表記11号(40号/L相当) 茶/ブラウン ベージュ 絹刺繍 半袖 春夏向け セットアップ レディース,18920,0,0,0,美品,伊太利屋,GK,クラシカルスカートスーツ,表記11号(40号,L相当),茶,ブラウン,ベージュ,絹刺繍,半袖,春夏向け,セットアップ,レディース,,,,,,,,,
2024/12/27 16:14:37,,美品/ハーレー Harley ふっくらウールニット スコットランド製 大きいサイズ 表記38号(13号/LL相当) グレー ウール100％ トップス 秋冬向け,13200,0,0,0,美品,ハーレー,Harley,ふっくらウールニット,スコットランド製,大きいサイズ,表記38号(13号,LL相当),グレー,ウール100％,トップス,秋冬向け,,,,,,,,,,,
2024/12/26 19:13:16,,美品/伊太利屋 GK 変形デザインコート 表記9号(38号/M相当) グレー 毛ウール100% 銀スタッズ ジップアップ 秋冬向け アウター レディース,19800,0,0,0,美品,伊太利屋,GK,変形デザインコート,表記9号(38号,M相当),グレー,毛ウール100%,銀スタッズ,ジップアップ,秋冬向け,アウター,レディース,,,,,,,,,,
2024/12/25 20:34:11,,M美品/伊太利屋 GK 優雅スカートスーツ 表記11号(40号/L相当) 黒/ブラック 艶感 ジャガード織り 半袖 薄手 春夏向 セットアップ レディース,24900,0,0,0,M美品,伊太利屋,GK,優雅スカートスーツ,表記11号(40号,L相当),黒,ブラック,艶感,ジャガード織り,半袖,薄手,春夏向,セットアップ,レディース,,,,,,,,
2024/12/25 07:52:01,,A新品同様*PINORE*ピノーレ*黒*美脚ストレッチパンツ40/11,5500,0,0,600,A新品同様*PINORE*ピノーレ*黒*美脚ストレッチパンツ40,11,,,,,,,,,,,,,,,,,,,,,
2024/12/23 20:41:44,,美品/アナイ ANAYI 上品ツイードスカート 小さいサイズ 表記36号(7号/S相当) ベージュ系 綿コットン素材 春秋向け ボトムス レディース,4950,0,0,0,美品,アナイ,ANAYI,上品ツイードスカート,小さいサイズ,表記36号(7号,S相当),ベージュ系,綿コットン素材,春秋向け,ボトムス,レディース,,,,,,,,,,,
2024/12/22 13:43:32,,レキシオネオ LexioNeo 韓国 ボードゲーム 牌ボードゲーム 麻雀 ポーカー 大富豪 Lexio レキシオ レキシオプラス アナログゲーム 送料無料 パーティー 2〜5人,12001,0,545,0,レキシオネオ,LexioNeo,韓国,ボードゲーム,牌ボードゲーム,麻雀,ポーカー,大富豪,Lexio,レキシオ,レキシオプラス,アナログゲーム,送料無料,パーティー,2〜5人,,,,,,,,
2024/12/22 06:00:38,,美品/CELEB MOI タートルニット セーター カシミヤ100 表記 M L 9号 11号 相当 茶 ブラウン レディース 秋冬 トップス 長袖 タートルネック,7040,0,0,600,美品,CELEB,MOI,タートルニット,セーター,カシミヤ100,表記,M,L,9号,11号,相当,茶,ブラウン,レディース,秋冬,トップス,長袖,タートルネック,,,,
2024/12/21 07:17:50,,美品/ドゥクラッセ DoCLASSE チェスターコート 表記 11号 40号 相当 古着 黒 ブラック レディース 春 秋 冬 アウター 通勤 張り感 シンプル,16720,-836,0,0,美品,ドゥクラッセ,DoCLASSE,チェスターコート,表記,11号,40号,相当,古着,黒,ブラック,レディース,春,秋,冬,アウター,通勤,張り感,シンプル,,,,
2024/12/20 21:52:32,,Ａ美品/ニューヨーカー NEWYORKER お洒落なワンピーススーツ 表記9号(38号相当) 黒/ブラック ドット柄デザイン 春夏 レディース,12900,0,0,0,Ａ美品,ニューヨーカー,NEWYORKER,お洒落なワンピーススーツ,表記9号(38号相当),黒,ブラック,ドット柄デザイン,春夏,レディース,,,,,,,,,,,,,
2024/12/20 12:47:51,,H美品/23区 極暖ウール100%コート 表記46号(11号Lサイズ相当) ベージュ/茶/ブラウン 秋冬向け お出掛け 謝恩会 女子会 アウター レディース,9801,0,0,600,H美品,23区,極暖ウール100%コート,表記46号(11号Lサイズ相当),ベージュ,茶,ブラウン,秋冬向け,お出掛け,謝恩会,女子会,アウター,レディース,,,,,,,,,,
2024/12/19 13:43:27,,美品/スキャパ SCAPA チュニック 大きい 表記 42号 13号 相当 茶 ブラウン 毛 ウール ボタニカル柄 お出掛け 春夏 トップス レディース,9350,-935,0,600,美品,スキャパ,SCAPA,チュニック,大きい,表記,42号,13号,相当,茶,ブラウン,毛,ウール,ボタニカル柄,お出掛け,春夏,トップス,レディース,,,,,
2024/12/19 07:08:31,,美品/群言堂 石見銀山 大人な美形コート 大きいサイズ (15号〜17号相当) グレー 斜めライン柄 お出掛け 春秋向け アウター レディース,26950,0,0,0,美品,群言堂,石見銀山,大人な美形コート,大きいサイズ,(15号〜17号相当),グレー,斜めライン柄,お出掛け,春秋向け,アウター,レディース,,,,,,,,,,,
2024/12/17 10:05:11,,美品/マニフェストMANIFEST 極柔カシミア100%半袖ニット 表記Lサイズ(11号相当) キャメル 秋冬向け お出かけ トップス レディース,4950,0,0,0,美品,マニフェストMANIFEST,極柔カシミア100%半袖ニット,表記Lサイズ(11号相当),キャメル,秋冬向け,お出かけ,トップス,レディース,,,,,,,,,,,,,,
2024/12/17 10:05:11,,M美品/your impressive 極柔カシミヤ100%ニット 表記L号(11号/40号相当) カーキ 大人渋色 半袖 ハイネック 秋冬 トップス レディース,5300,0,0,0,M美品,your,impressive,極柔カシミヤ100%ニット,表記L号(11号,40号相当),カーキ,大人渋色,半袖,ハイネック,秋冬,トップス,レディース,,,,,,,,,,
2024/12/17 10:00:18,,H美品/PINORE ピノーレ ゆったり大人チュニックニット 表記11E号(Lサイズ相当) 黒/ブラック 春秋冬向け ウール100％ トップス レディース,5500,0,0,600,H美品,PINORE,ピノーレ,ゆったり大人チュニックニット,表記11E号(Lサイズ相当),黒,ブラック,春秋冬向け,ウール100％,トップス,レディース,,,,,,,,,,,,
2024/12/16 08:51:18,,H新品同様/ジャンニロジュディチェ GIANNI LO GIUDICE ふんわりコート 大きめ表記42号(13号LLサイズ相当) 茶 秋冬向け アウター レディース,16900,0,0,0,H新品同様,ジャンニロジュディチェ,GIANNI,LO,GIUDICE,ふんわりコート,大きめ表記42号(13号LLサイズ相当),茶,秋冬向け,アウター,レディース,,,,,,,,,,,,
2024/12/14 15:38:46,,M美品*カールラガーフェルド/KARL LAGERFELD*黒*美的スカート*38/9,4995,0,0,600,M美品*カールラガーフェルド,KARL,LAGERFELD*黒*美的スカート*38,9,,,,,,,,,,,,,,,,,,,
2024/12/13 08:21:48,,A美品/アクアスキュータム Aquascutum お洒落ラップ風スカート 小さいサイズ 表記9号(7号/S相当) 茶 チェック柄 ウール100％ 秋冬 ボトムス,9799,-111,0,600,A美品,アクアスキュータム,Aquascutum,お洒落ラップ風スカート,小さいサイズ,表記9号(7号,S相当),茶,チェック柄,ウール100％,秋冬,ボトムス,,,,,,,,,,,
2024/12/08 19:50:22,,A新品同様/H＆M/エイチ＆エム/茶/ダブルボタン/暖か美形コート/40号(11号*L相当)秋冬/レディース,5500,0,0,600,A新品同様,H＆M,エイチ＆エム,茶,ダブルボタン,暖か美形コート,40号(11号*L相当)秋冬,レディース,,,,,,,,,,,,,,,
2024/12/08 11:58:01,,美品/ノーマカマリ NORMA KAMALI スカートスーツ 表記M 9号相当 ボルドー 2点セット ベロア シンプル 艶感 秋 冬 セットアップ レディース,15730,0,0,0,美品,ノーマカマリ,NORMA,KAMALI,スカートスーツ,表記M,9号相当,ボルドー,2点セット,ベロア,シンプル,艶感,秋,冬,セットアップ,レディース,,,,,,,
2024/12/08 10:33:38,,美品/東京ソワール SOIR DOLCE 美艶ベロアスカート 膝丈 大きいサイズ 表記13号(LL相当) 黒/ブラック 秋冬向け ボトムス レディース,11000,0,0,0,美品,東京ソワール,SOIR,DOLCE,美艶ベロアスカート,膝丈,大きいサイズ,表記13号(LL相当),黒,ブラック,秋冬向け,ボトムス,レディース,,,,,,,,,,
2024/12/05 12:59:28,,M美品/高級ちりめんスカートスーツ 大きいサイズ 表記13号(42号/LL相当) 黒/ブラック 和柄デザイン ノーカラー 長袖 春秋向け レディース,15800,0,0,0,M美品,高級ちりめんスカートスーツ,大きいサイズ,表記13号(42号,LL相当),黒,ブラック,和柄デザイン,ノーカラー,長袖,春秋向け,レディース,,,,,,,,,,,
2024/12/05 10:37:15,,美品/マカフィー MACPHEE タイトスカート 小さいサイズ 36号 S 相当 茶 ブラウン レディース 秋 冬 ボトムス コーデュロイ 綿100 コットン,7920,0,0,600,美品,マカフィー,MACPHEE,タイトスカート,小さいサイズ,36号,S,相当,茶,ブラウン,レディース,秋,冬,ボトムス,コーデュロイ,綿100,コットン,,,,,,
2024/12/02 23:21:09,,美品/23区 フレアスカート スカート 小さいサイズ 表記34号 7号 S相当 茶 ブラウン 毛100 ウール ふっくら 膝丈 秋 冬 ボトムス レディース,6270,0,0,600,美品,23区,フレアスカート,スカート,小さいサイズ,表記34号,7号,S相当,茶,ブラウン,毛100,ウール,ふっくら,膝丈,秋,冬,ボトムス,レディース,,,,,
2024/12/01 16:42:54,,新品同様/カーラ Cara お洒落ツイードフリンジジャケット Lサイズ(11号相当) 黒/ブラック/ピンク 秋冬向け 食事会 アウター レディース,20900,-2000,0,0,新品同様,カーラ,Cara,お洒落ツイードフリンジジャケット,Lサイズ(11号相当),黒,ブラック,ピンク,秋冬向け,食事会,アウター,レディース,,,,,,,,,,,
2024/11/30 19:33:07,,H美品/ FRAGILE フラジール 極柔ニット セーター 表記38号(Mサイズ相当) 白/オフホワイト 春秋冬向け イタリア製糸混 トップス レディース,5500,0,0,600,H美品,FRAGILE,フラジール,極柔ニット,セーター,表記38号(Mサイズ相当),白,オフホワイト,春秋冬向け,イタリア製糸混,トップス,レディース,,,,,,,,,,,
2024/11/30 18:00:30,,A新品同様*組曲*茶*美揺れプリーツスカート3/11,5000,0,0,600,A新品同様*組曲*茶*美揺れプリーツスカート3,11,,,,,,,,,,,,,,,,,,,,,
2024/11/25 21:53:32,,美品/ソニアリキエル SONIA RYKIEL ニットチュニック イタリア製 表記 42号 13号 相当 古着 黒 ブラック レディース 秋 冬 トップス 長袖,8800,0,0,600,美品,ソニアリキエル,SONIA,RYKIEL,ニットチュニック,イタリア製,表記,42号,13号,相当,古着,黒,ブラック,レディース,秋,冬,トップス,長袖,,,,,
2024/11/24 23:46:12,,新品同様/インゲボルグ INGEBORG ピンクハウス ラップスカート ロング 9号 M 相当 茶 レディース 秋 冬 ボトムス 毛100 ウール チェック柄,13970,-699,0,0,新品同様,インゲボルグ,INGEBORG,ピンクハウス,ラップスカート,ロング,9号,M,相当,茶,レディース,秋,冬,ボトムス,毛100,ウール,チェック柄,,,,,,
2024/11/21 07:38:08,,A美品*リフレクト*黒*5段フリル♪ふっくら美形スカート9,6800,-2000,0,600,A美品*リフレクト*黒*5段フリル♪ふっくら美形スカート9,,,,,,,,,,,,,,,,,,,,,,
2024/11/20 19:02:25,,美品/アンタイトル UNTITLED フレアスカート 台形 小さい 表記 1号 S 相当 黒 ブラック レディース 秋 冬 ボトムス 千鳥格子柄 毛混 膝丈,10450,0,0,0,美品,アンタイトル,UNTITLED,フレアスカート,台形,小さい,表記,1号,S,相当,黒,ブラック,レディース,秋,冬,ボトムス,千鳥格子柄,毛混,膝丈,,,,
2024/11/18 17:53:16,,美品/フェンディ FENDI レザースカート イタリア製 表記 I42号 9号 相当 茶 ブラウン 本革 タイト ヴィンテージ 秋 冬 ボトムス レディース,30800,0,0,0,美品,フェンディ,FENDI,レザースカート,イタリア製,表記,I42号,9号,相当,茶,ブラウン,本革,タイト,ヴィンテージ,秋,冬,ボトムス,レディース,,,,,
2024/11/18 16:39:22,,A美品/ズッカ zucca ゆったりウールジャケット 小さいサイズ 表記S(7号相当) 黒/ブラック お出掛け 秋冬向け アウター レディース,17210,0,0,0,A美品,ズッカ,zucca,ゆったりウールジャケット,小さいサイズ,表記S(7号相当),黒,ブラック,お出掛け,秋冬向け,アウター,レディース,,,,,,,,,,,
2024/11/17 12:38:28,,美品/ラピーヌ LAPINE フレアスカート ロングスカート ジャガード 大きいサイズ 表記 44号 15号 相当 ベージュ レディース 春 秋 ボトムス,7700,0,0,600,美品,ラピーヌ,LAPINE,フレアスカート,ロングスカート,ジャガード,大きいサイズ,表記,44号,15号,相当,ベージュ,レディース,春,秋,ボトムス,,,,,,,
2024/11/14 12:33:33,,M美品/リフレクト Reflect ウール系ツイードスカート 大きいサイズ42号(13号/LL相当) 茶/ブラウン ベージュ ラメ 秋冬 ボトムス レディース,5480,0,0,600,M美品,リフレクト,Reflect,ウール系ツイードスカート,大きいサイズ42号(13号,LL相当),茶,ブラウン,ベージュ,ラメ,秋冬,ボトムス,レディース,,,,,,,,,,
2024/11/13 09:31:50,,M美品/ランズエンド LANDS'END 極柔カシミヤ100% ふっくらニット 表記L(11号/40号相当) グレー シンプル 長袖 秋冬向 トップス レディース,8900,0,0,600,M美品,ランズエンド,LANDS'END,極柔カシミヤ100%,ふっくらニット,表記L(11号,40号相当),グレー,シンプル,長袖,秋冬向,トップス,レディース,,,,,,,,,,
2024/11/08 19:25:50,,美品/東京ソワール TOKYO SOIR ブラックフォーマルスカートスーツ 3点セット 表記 11号 L 相当 黒 ブラック 冠婚葬祭 喪服 レディース,31130,-2000,0,0,美品,東京ソワール,TOKYO,SOIR,ブラックフォーマルスカートスーツ,3点セット,表記,11号,L,相当,黒,ブラック,冠婚葬祭,喪服,レディース,,,,,,,,
2024/11/07 22:57:24,,H新品同様/23区 異素材ドット柄タイトスカート 表記40号(11号Lサイズ相当) 黒/ブラック 秋冬向け フロッキー加工 ラメ ボトムス レディース,5951,0,0,600,H新品同様,23区,異素材ドット柄タイトスカート,表記40号(11号Lサイズ相当),黒,ブラック,秋冬向け,フロッキー加工,ラメ,ボトムス,レディース,,,,,,,,,,,,
2024/11/06 23:01:20,,A新品同様/アンタイトル UNTITLED 優秀ハーフパンツ 2号(9号/38号相当) グレー チェック柄 耀きラメ 秋冬向け ボトムス レディース,5500,-550,0,600,A新品同様,アンタイトル,UNTITLED,優秀ハーフパンツ,2号(9号,38号相当),グレー,チェック柄,耀きラメ,秋冬向け,ボトムス,レディース,,,,,,,,,,,
2024/11/03 15:46:15,,M美品/マックスコー MAX&CO マックスマーラ 美形テーラードジャケット イタリア製 7号/S相当 茶/ブラウン 毛素材 秋冬 アウター レディース,17300,0,0,0,M美品,マックスコー,MAX&CO,マックスマーラ,美形テーラードジャケット,イタリア製,7号,S相当,茶,ブラウン,毛素材,秋冬,アウター,レディース,,,,,,,,,
2024/11/03 08:18:01,,Ａ美品/セオリー theory お洒落なツイードジャケット 表記2号(9号/Mサイズ相当) 茶色/ブラウン ミリタリー風 春秋向け アウター,16000,0,0,0,Ａ美品,セオリー,theory,お洒落なツイードジャケット,表記2号(9号,Mサイズ相当),茶色,ブラウン,ミリタリー風,春秋向け,アウター,,,,,,,,,,,,
2024/11/03 01:39:04,,美品/ラルフローレン RALPH LAUREN ロングチェスターコート 表記11号(40号/L相当) ベージュ 毛ウール混 秋冬向け アウター レディース,30800,0,0,0,美品,ラルフローレン,RALPH,LAUREN,ロングチェスターコート,表記11号(40号,L相当),ベージュ,毛ウール混,秋冬向け,アウター,レディース,,,,,,,,,,,
2024/11/01 02:44:07,,新品同様/グレープ横浜元町 grape フレアスカート ロングスカート 9号 M 38号 相当 グレー レディース 春 秋 ボトムス シンプル ストレッチ,7700,0,0,600,新品同様,グレープ横浜元町,grape,フレアスカート,ロングスカート,9号,M,38号,相当,グレー,レディース,春,秋,ボトムス,シンプル,ストレッチ,,,,,,,
2024/10/29 19:59:04,,新品同様/アリスバーリー Aylesbury お洒落トレンチコート 大きいサイズ 表記LL(13号相当) 薄緑/グリーン 春秋向け アウター レディース,19800,0,0,0,新品同様,アリスバーリー,Aylesbury,お洒落トレンチコート,大きいサイズ,表記LL(13号相当),薄緑,グリーン,春秋向け,アウター,レディース,,,,,,,,,,,,
2024/10/28 23:35:42,,M美品/ザラ ZARA 圧縮ウール素材スカート 表記M(9号/38号相当) グレー スリット入り シンプルデザイン タイト 秋冬向 ボトムス レディース,5951,0,0,600,M美品,ザラ,ZARA,圧縮ウール素材スカート,表記M(9号,38号相当),グレー,スリット入り,シンプルデザイン,タイト,秋冬向,ボトムス,レディース,,,,,,,,,,
2024/10/27 22:18:48,,M美品/グレード GRADE ふっくら暖かダウンコート/ジャケット 大きいサイズ 表記17号(46号/4L相当) 黒/ブラック 秋冬向 アウター レディース,17210,0,0,0,M美品,グレード,GRADE,ふっくら暖かダウンコート,ジャケット,大きいサイズ,表記17号(46号,4L相当),黒,ブラック,秋冬向,アウター,レディース,,,,,,,,,,
2024/10/26 22:31:43,,M新品同様/J.プレス J PRESS 美編みショート丈ニット 表記M(9号/38号相当) グレー 柔ウール100% トナカイ柄 秋冬向け トップス レディース,4210,0,0,0,M新品同様,J.プレス,J,PRESS,美編みショート丈ニット,表記M(9号,38号相当),グレー,柔ウール100%,トナカイ柄,秋冬向け,トップス,レディース,,,,,,,,,,
2024/10/26 22:28:30,,美品/23区 ニット アンサンブル 表記 38号 9号 M 相当 黒 ブラック レディース 春 夏 秋 冬 長袖 半袖 毛混 ウール ラメ カーディガン 丸首,7920,0,0,600,美品,23区,ニット,アンサンブル,表記,38号,9号,M,相当,黒,ブラック,レディース,春,夏,秋,冬,長袖,半袖,毛混,ウール,ラメ,カーディガン,丸首
2024/10/24 13:51:16,,A美品/HILFIGER DENIM ヒルフィガーデニム ジップアップニットジャケット 小さいサイズ XSサイズ(5号/32号相当)カシミヤ混 グレー 秋冬向け,6210,0,0,600,A美品,HILFIGER,DENIM,ヒルフィガーデニム,ジップアップニットジャケット,小さいサイズ,XSサイズ(5号,32号相当)カシミヤ混,グレー,秋冬向け,,,,,,,,,,,,,
2024/10/23 18:41:27,,美品/アニエスベー ADRIEN BEAU agnes b スラックスパンツ フランス製 表記 38号 9号 相当 グレー 羊毛 ウール 秋冬 ボトムス レディース,13200,0,0,0,美品,アニエスベー,ADRIEN,BEAU,agnes,b,スラックスパンツ,フランス製,表記,38号,9号,相当,グレー,羊毛,ウール,秋冬,ボトムス,レディース,,,,,
2024/10/20 23:33:40,,Ａ美品/バーバリー BURBERRYS お洒落セットアップ イタリア製生地 小さいサイズ 表記9号(7号相当) 緑/グリーン チェック柄 春夏 レディース,24900,0,0,0,Ａ美品,バーバリー,BURBERRYS,お洒落セットアップ,イタリア製生地,小さいサイズ,表記9号(7号相当),緑,グリーン,チェック柄,春夏,レディース,,,,,,,,,,,
2024/10/20 16:27:02,,美品/プラステ PLST セオリー ニットワンピース 表記 M 9号 相当 紺 ネイビー Vネック シンプル 無地 オフィス お出掛け 春秋 レディース,14520,0,0,0,美品,プラステ,PLST,セオリー,ニットワンピース,表記,M,9号,相当,紺,ネイビー,Vネック,シンプル,無地,オフィス,お出掛け,春秋,レディース,,,,,
2024/10/19 09:37:43,,M美品/シャミー Chamois 羽織系ニットカーディガン 表記F(9号/11号/大きいサイズ13号相当) 黒 7分袖 刺繍 毛100% 秋冬 トップス レディース,12800,0,0,0,M美品,シャミー,Chamois,羽織系ニットカーディガン,表記F(9号,11号,大きいサイズ13号相当),黒,7分袖,刺繍,毛100%,秋冬,トップス,レディース,,,,,,,,,
2024/10/14 21:35:01,,A新品同様/ ギャルリーヴィー GALERIE VIE 爽やかなブラウス (9号/M相当) 青/ブルー ピンストライプ柄 春夏秋向け トップス レディース,5500,0,0,600,A新品同様,ギャルリーヴィー,GALERIE,VIE,爽やかなブラウス,(9号,M相当),青,ブルー,ピンストライプ柄,春夏秋向け,トップス,レディース,,,,,,,,,,
2024/10/13 01:39:55,,M美*ザラZARA KNIT♪紺白*フード裏ボア*ざっくり暖ニットベストM,5300,0,0,600,M美*ザラZARA,KNIT♪紺白*フード裏ボア*ざっくり暖ニットベストM,,,,,,,,,,,,,,,,,,,,,
2024/10/12 16:58:27,,H美品/Pierre cardin ピエールカルダン 美彩ふっくらニットコート 表記M(9~11号相当) 紫 ウール混 秋冬向け チェック アウター レディース,24900,0,0,0,H美品,Pierre,cardin,ピエールカルダン,美彩ふっくらニットコート,表記M(9~11号相当),紫,ウール混,秋冬向け,チェック,アウター,レディース,,,,,,,,,,,
2024/10/05 18:34:13,,美品/レリアン Leilian シャツブラウス ジャケット 表記11号 L相当 古着 オフホワイト 白系 レディース 薄手 春夏 トップス 7分袖 ゆったり,22000,-1500,0,0,美品,レリアン,Leilian,シャツブラウス,ジャケット,表記11号,L相当,古着,オフホワイト,白系,レディース,薄手,春夏,トップス,7分袖,ゆったり,,,,,,,
2024/10/05 17:14:16,,新品同様/イギン BILL BLASS シフォン素材ワンピース 大きいサイズ 表記15号(3L相当) 黒/ブラック ロング丈 袖フリル 春夏向け レディース,23100,-1500,0,0,新品同様,イギン,BILL,BLASS,シフォン素材ワンピース,大きいサイズ,表記15号(3L相当),黒,ブラック,ロング丈,袖フリル,春夏向け,レディース,,,,,,,,,,
2024/10/05 00:04:22,,新品同様/トゥーシー TWO:C ワンピース 表記 40号 11号 L 相当 古着 黒 ブラック レディース 春 夏 半袖 膝丈 ひざ丈 ノーカラー シンプル,11000,-2000,0,0,新品同様,トゥーシー,TWO:C,ワンピース,表記,40号,11号,L,相当,古着,黒,ブラック,レディース,春,夏,半袖,膝丈,ひざ丈,ノーカラー,シンプル,,,
2024/09/30 12:17:48,,美品/ヤッコマリカルド YACCO MARICARD チュニック 大きい 表記 N 13号 15号 相当 緑 グリーン ピンタック 春 秋 トップス レディース,19030,0,0,0,美品,ヤッコマリカルド,YACCO,MARICARD,チュニック,大きい,表記,N,13号,15号,相当,緑,グリーン,ピンタック,春,秋,トップス,レディース,,,,,
2024/09/30 12:17:48,,美品/ヤッコマリカルド YACCO MARICARD コットンブラウス 11号 13号 相当 黒 ブラック 綿 ボーダー柄 おしゃれ 春 夏 トップス レディース,18480,0,0,0,美品,ヤッコマリカルド,YACCO,MARICARD,コットンブラウス,11号,13号,相当,黒,ブラック,綿,ボーダー柄,おしゃれ,春,夏,トップス,レディース,,,,,,
