OrderTime,SubCode,Title,UnitPrice,TotalMallCouponDiscount,UsePoint,ShipCharge,Title_1,Title_2,Title_3,Title_4,Title_5,Title_6,Title_7,Title_8,Title_9,Title_10,Title_11,Title_12,Title_13,Title_14,Title_15,Title_16,Title_17,Title_18,Title_19,Title_20,Title_21,Title_22,Title_23
2024/06/28 15:25:06,,美品/レリアン Leilian カットソー 大きい 表記 13号 LL 相当 オレンジ 茶 モダン柄 七分袖 おしゃれ お出掛け 春 夏 トップス レディース,17380,-869,0,0,美品,レリアン,Leilian,カットソー,大きい,表記,13号,LL,相当,オレンジ,茶,モダン柄,七分袖,おしゃれ,お出掛け,春,夏,トップス,レディース,,,,
2024/06/21 15:51:01,,美品/詩仙堂 ヒトシタムラ カットソー ノースリーブ タンクトップ ちりめん 大きいサイズ LL 3L相当 黒 ブラック レディース 春夏 トップス,5500,0,250,600,美品,詩仙堂,ヒトシタムラ,カットソー,ノースリーブ,タンクトップ,ちりめん,大きいサイズ,LL,3L相当,黒,ブラック,レディース,春夏,トップス,,,,,,,,
2024/06/20 10:11:44,,A新品同様/ ラピーヌブランシェ LAPINE BLANCHE フリルジャケット 表記9号(M相当) グレー 微小幾何学柄 パーティー 春夏秋向け アウター,12900,0,0,0,A新品同様,ラピーヌブランシェ,LAPINE,BLANCHE,フリルジャケット,表記9号(M相当),グレー,微小幾何学柄,パーティー,春夏秋向け,アウター,,,,,,,,,,,,
2024/06/20 08:34:58,,新品同様/ハーディエイミス ノースリーブワンピース 表記 11号 L 相当 黒 艶感 シンプル 無地 結婚式 春夏秋 レディース,29150,0,0,0,新品同様,ハーディエイミス,ノースリーブワンピース,表記,11号,L,相当,黒,艶感,シンプル,無地,結婚式,春夏秋,レディース,,,,,,,,,
2024/06/16 20:50:38,,M美品/CECI OU CELA/セシオセラ/茶/伸縮/薄地/大人ノーカラージャケット/M/春夏秋,6790,-1500,0,0,M美品,CECI,OU,CELA,セシオセラ,茶,伸縮,薄地,大人ノーカラージャケット,M,春夏秋,,,,,,,,,,,,
2024/06/16 20:50:38,,M美品*セシオセラ*茶*シフォン×透感×花柄*素敵フレアスカート9,6800,-1500,0,0,M美品*セシオセラ*茶*シフォン×透感×花柄*素敵フレアスカート9,,,,,,,,,,,,,,,,,,,,,,
2024/06/16 20:50:38,,H美品/PRESSE ピノーレ 美彩艶感ブラウス 表記40号(11号Lサイズ相当) 赤/レッド/ワインレッド 春夏向け お食事会 トップス レディース,6800,-1500,0,0,H美品,PRESSE,ピノーレ,美彩艶感ブラウス,表記40号(11号Lサイズ相当),赤,レッド,ワインレッド,春夏向け,お食事会,トップス,レディース,,,,,,,,,,,
2024/06/16 11:32:51,,美品/ダブルスタンダードクロージング DOUBLE STANDARD CLOTHING ノースリーブカットソー M L 相当 古着 黒 ブラック レディース トップス,8580,0,0,600,美品,ダブルスタンダードクロージング,DOUBLE,STANDARD,CLOTHING,ノースリーブカットソー,M,L,相当,古着,黒,ブラック,レディース,トップス,,,,,,,,,
2024/06/13 13:41:45,,新品同様/ジュンコシマダ 49AV JUNKO SHIMADA カーディガン 表記 38号 M 相当 ベージュ レディース 春 夏 麻100 7分袖 カットワークレース,13200,0,0,0,新品同様,ジュンコシマダ,49AV,JUNKO,SHIMADA,カーディガン,表記,38号,M,相当,ベージュ,レディース,春,夏,麻100,7分袖,カットワークレース,,,,,,
2024/06/13 05:10:48,,M美品/ナラカミーチェ NARACAMICIE 総カットワークレースブラウス イタリア製 表記1号(9号相当) 白 7分袖 綿100% 春夏 トップス レディース,6199,0,0,0,M美品,ナラカミーチェ,NARACAMICIE,総カットワークレースブラウス,イタリア製,表記1号(9号相当),白,7分袖,綿100%,春夏,トップス,レディース,,,,,,,,,,,
2024/06/13 05:10:48,,セール★美品*Lois CRAYON ロイスクレヨン*ベージュ*七分袖*ステッチ*素敵ジャケットM(9号相当)/春夏向け レディース/値下18000→8200,6799,0,0,0,セール★美品*Lois,CRAYON,ロイスクレヨン*ベージュ*七分袖*ステッチ*素敵ジャケットM(9号相当),春夏向け,レディース,値下18000→8200,,,,,,,,,,,,,,,,,
2024/06/12 23:02:11,,Ａ新品同様/ナラカミーチェ NARACAMICIE 爽やか半袖ブラウス 表記2号(9号/M相当) 青/ブルー 伸縮性 ストライプ柄 春夏 トップス レディース,6200,0,0,600,Ａ新品同様,ナラカミーチェ,NARACAMICIE,爽やか半袖ブラウス,表記2号(9号,M相当),青,ブルー,伸縮性,ストライプ柄,春夏,トップス,レディース,,,,,,,,,,
2024/06/11 14:14:31,,A美品/TSUMORI CHISATO 　ツモリチサト/黒/上品レース/素敵プリーツカットソー/2/9,4210,0,0,600,A美品,TSUMORI,CHISATO,　ツモリチサト,黒,上品レース,素敵プリーツカットソー,2,9,,,,,,,,,,,,,,
2024/06/09 09:23:42,,新品同様/イッセイミヤケ ISSEY MIYAKE FETE プリーツカットソー 表記 2号 9号 相当 黒 グレー モダン総柄 春 夏 トップス レディース,25630,-1500,0,0,新品同様,イッセイミヤケ,ISSEY,MIYAKE,FETE,プリーツカットソー,表記,2号,9号,相当,黒,グレー,モダン総柄,春,夏,トップス,レディース,,,,,,
2024/06/03 22:56:31,,Ａ美品/ローラアシュレイ LAURA ASHLEY 暖か美脚パンツ 小さいサイズ 表記11号(7号/S相当) 茶/ブラウン カシミヤ混 秋冬 ボトムス,7300,0,0,600,Ａ美品,ローラアシュレイ,LAURA,ASHLEY,暖か美脚パンツ,小さいサイズ,表記11号(7号,S相当),茶,ブラウン,カシミヤ混,秋冬,ボトムス,,,,,,,,,,
2024/06/03 02:57:05,,M美品/総レースカーディガン 小さいサイズ7号(36号/S相当) ベージュ 淡色 透け感 長袖 綿100%素材 美編み 春夏向け トップス レディース,4210,0,0,600,M美品,総レースカーディガン,小さいサイズ7号(36号,S相当),ベージュ,淡色,透け感,長袖,綿100%素材,美編み,春夏向け,トップス,レディース,,,,,,,,,,
2024/06/03 00:20:23,,M新品同様/オペークドットクリップ OPAQUE.CLIP ワールド 花柄ワンピース 表記38号(9号/M相当) 黒×白 2P風デザイン 春夏 レディース,5480,0,0,600,M新品同様,オペークドットクリップ,OPAQUE.CLIP,ワールド,花柄ワンピース,表記38号(9号,M相当),黒×白,2P風デザイン,春夏,レディース,,,,,,,,,,,,
2024/06/01 23:16:18,,H美品/ウィルセレクション WILLSELECTION 可憐プリーツワンピース 小さいサイズ表記1号(7号Sサイズ相当) 桃/ピンク 春秋向け レディース,6810,0,0,600,H美品,ウィルセレクション,WILLSELECTION,可憐プリーツワンピース,小さいサイズ表記1号(7号Sサイズ相当),桃,ピンク,春秋向け,レディース,,,,,,,,,,,,,,
2024/06/01 21:10:16,,新品同様/トランスワーク TRANS WORK ペイズリー柄チュニック 表記40号(11号相当) 青紫系 7分袖 フレア袖 透け感 春夏 トップス レディース,8800,-880,0,600,新品同様,トランスワーク,TRANS,WORK,ペイズリー柄チュニック,表記40号(11号相当),青紫系,7分袖,フレア袖,透け感,春夏,トップス,レディース,,,,,,,,,,
2024/06/01 14:52:27,,美品/ジャーナルスタンダード JOURNAL STANDARD リネンジャケット 9号 M 相当 紺 ネイビー 麻 リネン 半袖 春夏 アウター レディース,6600,0,0,600,美品,ジャーナルスタンダード,JOURNAL,STANDARD,リネンジャケット,9号,M,相当,紺,ネイビー,麻,リネン,半袖,春夏,アウター,レディース,,,,,,,
2024/05/31 07:10:46,,美品*アツコノセ*黒×綺麗レース*麻混*素敵デザインワンピースM,6800,0,0,600,美品*アツコノセ*黒×綺麗レース*麻混*素敵デザインワンピースM,,,,,,,,,,,,,,,,,,,,,,
2024/05/29 19:40:00,,美品/エフデ ef-de スカーチョ ガウチョ 大きいサイズ 表記17号 4L相当 グレー 毛100 ウール シンプル ゆったり 春 秋 ボトムス レディース,7040,0,0,600,美品,エフデ,ef-de,スカーチョ,ガウチョ,大きいサイズ,表記17号,4L相当,グレー,毛100,ウール,シンプル,ゆったり,春,秋,ボトムス,レディース,,,,,,
2024/05/29 01:09:56,,H美品/BOSCH ボッシュ 素敵7分袖カットソー 小さいサイズ表記38号(7号Sサイズ相当) 黒/ブラック 綿混 春秋向 お出掛けトップス レディース,5480,0,0,600,H美品,BOSCH,ボッシュ,素敵7分袖カットソー,小さいサイズ表記38号(7号Sサイズ相当),黒,ブラック,綿混,春秋向,お出掛けトップス,レディース,,,,,,,,,,,,
2024/05/28 12:20:34,,美品/ビースリー B3 B-three スラックスパンツ 表記 36号 11号 相当 紺 ネイビー ストレッチ性 無地 オフィス 春 秋 ボトムス レディース,7700,0,797,0,美品,ビースリー,B3,B-three,スラックスパンツ,表記,36号,11号,相当,紺,ネイビー,ストレッチ性,無地,オフィス,春,秋,ボトムス,レディース,,,,,
2024/05/28 12:20:34,,新品同様/アナイ ANAYI カーディガン 羽織り 小さいサイズ 表記 36号 S 相当 紺 ネイビー レディース 春夏 トップス ニット 麻 リネン 変形,8250,0,797,0,新品同様,アナイ,ANAYI,カーディガン,羽織り,小さいサイズ,表記,36号,S,相当,紺,ネイビー,レディース,春夏,トップス,ニット,麻,リネン,変形,,,,
2024/05/28 01:03:35,,美品/ビスケー BC 大人テーラードジャケット 大きいサイズ 13号/LL相当 濃グレー系 綿/コットン素材 通勤 春秋冬向け アウター レディース,15400,0,0,0,美品,ビスケー,BC,大人テーラードジャケット,大きいサイズ,13号,LL相当,濃グレー系,綿,コットン素材,通勤,春秋冬向け,アウター,レディース,,,,,,,,,
2024/05/27 18:45:02,,新品同様/プラステ PLST セオリー テーラードジャケット 表記 M 9号 相当 黒 ブラック ダブルボタン オフィス 春秋 アウター レディース,12650,-1000,0,0,新品同様,プラステ,PLST,セオリー,テーラードジャケット,表記,M,9号,相当,黒,ブラック,ダブルボタン,オフィス,春秋,アウター,レディース,,,,,,,
2024/05/27 08:46:28,,美品/ローラアシュレイ LAURA ASHLEY ガウチョパンツ スカーチョ 表記 9号 Ｍ 相当 古着 黒 ブラック レディース 春 夏 ボトムス ゆったり,13200,-1000,0,0,美品,ローラアシュレイ,LAURA,ASHLEY,ガウチョパンツ,スカーチョ,表記,9号,Ｍ,相当,古着,黒,ブラック,レディース,春,夏,ボトムス,ゆったり,,,,,
2024/05/24 03:57:52,,M美品/スキャパ SCAPA 美揺フレアスカート 表記40号(11号/L相当) 黒/ブラック 上品ボタニカル柄 透け感素材 春夏向け ボトムス レディース,10030,0,0,0,M美品,スキャパ,SCAPA,美揺フレアスカート,表記40号(11号,L相当),黒,ブラック,上品ボタニカル柄,透け感素材,春夏向け,ボトムス,レディース,,,,,,,,,,
2024/05/21 23:22:55,,A美品/ ケーティーリノ K.T LINO 可憐なジャケット 大きいサイズ 表記13号(LL相当) 白/ホワイト 麻リネン 総レースデザイン 春夏 アウター,9799,0,0,0,A美品,ケーティーリノ,K.T,LINO,可憐なジャケット,大きいサイズ,表記13号(LL相当),白,ホワイト,麻リネン,総レースデザイン,春夏,アウター,,,,,,,,,,
2024/05/18 10:19:49,,新品同様/キャラオクルス CARA O CRUZ テーラードジャケット 表記 11号 L 相当 紺 ネイビー 毛 ウール 薄手 春 夏 アウター レディース,15950,0,20,0,新品同様,キャラオクルス,CARA,O,CRUZ,テーラードジャケット,表記,11号,L,相当,紺,ネイビー,毛,ウール,薄手,春,夏,アウター,レディース,,,,
2024/05/18 09:07:28,,H美品/オスカー OSKAR おしゃれノースリーブワンピース 小さいサイズ表記Sサイズ(7号相当) 黒/ブラック 春夏向け 重ね着風 レディース,5500,0,0,600,H美品,オスカー,OSKAR,おしゃれノースリーブワンピース,小さいサイズ表記Sサイズ(7号相当),黒,ブラック,春夏向け,重ね着風,レディース,,,,,,,,,,,,,
2024/05/18 06:13:39,,美品/レリアン Leilian 清楚ジャケット/ブラウス 表記13号(大きいサイズLL相当) 白/ホワイト ストレッチ 春夏 アウタートップス レディース,24200,-1500,0,0,美品,レリアン,Leilian,清楚ジャケット,ブラウス,表記13号(大きいサイズLL相当),白,ホワイト,ストレッチ,春夏,アウタートップス,レディース,,,,,,,,,,,
2024/05/17 04:32:46,,★美品*ヴィヴィアンタム♪茶系美柄♪ヒラヒラデザインスカート0,12800,0,0,0,★美品*ヴィヴィアンタム♪茶系美柄♪ヒラヒラデザインスカート0,,,,,,,,,,,,,,,,,,,,,,
2024/05/14 10:34:30,,M新品同様/東京イギン TOKYO IGIN 上品フォーマルスカート 大きいサイズ 表記13号(LL相当) 黒/ブラック 透け感 春夏向 ボトムス レディース,6000,0,0,600,M新品同様,東京イギン,TOKYO,IGIN,上品フォーマルスカート,大きいサイズ,表記13号(LL相当),黒,ブラック,透け感,春夏向,ボトムス,レディース,,,,,,,,,,
2024/05/13 05:51:05,,新品同様/セオリー theory チュニック 小さい 表記 S 7号 相当 黒 ブラック 無地 シンプル 異素材切り替え 春 夏 トップス レディース,16500,-825,0,0,新品同様,セオリー,theory,チュニック,小さい,表記,S,7号,相当,黒,ブラック,無地,シンプル,異素材切り替え,春,夏,トップス,レディース,,,,,
2024/05/12 19:46:11,,美品/バラ色の暮し ロングスカート フレアスカート 表記 L 11号 相当 古着 黒 ブラック レディース 春 夏 ボトムス 綿100 コットン 刺繍,11000,-500,0,0,美品,バラ色の暮し,ロングスカート,フレアスカート,表記,L,11号,相当,古着,黒,ブラック,レディース,春,夏,ボトムス,綿100,コットン,刺繍,,,,,
2024/05/08 19:24:14,,美品/ボッシュ BOSCH スラックス パンツ 表記38号 9号 M相当 古着 黒 ブラック レディース 春 夏 秋 ボトムス 美脚 通勤 オフィス シンプル,14300,0,0,0,美品,ボッシュ,BOSCH,スラックス,パンツ,表記38号,9号,M相当,古着,黒,ブラック,レディース,春,夏,秋,ボトムス,美脚,通勤,オフィス,シンプル,,,
2024/05/07 22:08:54,,M美品/斉藤都世子 toyoko saito ニットの女王 上品ニットジャケット 9号/M〜11号/L相当 グレーブラウン系 秋冬向け アウター レディース,22810,0,0,0,M美品,斉藤都世子,toyoko,saito,ニットの女王,上品ニットジャケット,9号,M〜11号,L相当,グレーブラウン系,秋冬向け,アウター,レディース,,,,,,,,,,
2024/05/07 07:25:09,,新品/モガ MOGA カットソー 表記 F フリー M L LL 相当 グレー レディース 春 夏 トップス 綿100 コットン ゆったり シンプル 半袖 未使用,11000,-300,0,0,新品,モガ,MOGA,カットソー,表記,F,フリー,M,L,LL,相当,グレー,レディース,春,夏,トップス,綿100,コットン,ゆったり,シンプル,半袖,未使用,
2024/05/05 23:16:13,,美品/レリアン Leilian ワイドパンツ ロングパンツ 大きいサイズ 表記 13号 LL 相当 白 ホワイト レディース 春夏 ボトムス 薄手 シンプル,11000,-550,0,0,美品,レリアン,Leilian,ワイドパンツ,ロングパンツ,大きいサイズ,表記,13号,LL,相当,白,ホワイト,レディース,春夏,ボトムス,薄手,シンプル,,,,,,
2024/05/05 22:01:38,,美品/マレーラ MARELLA マックスマーラ フレアスカート 大きい 表記 JI44号 LL 相当 茶 ブラウン レディース 春 夏 ボトムス 絹100 シルク,12100,0,0,0,美品,マレーラ,MARELLA,マックスマーラ,フレアスカート,大きい,表記,JI44号,LL,相当,茶,ブラウン,レディース,春,夏,ボトムス,絹100,シルク,,,,,
2024/05/05 20:06:54,,美品/レリアン Leilian チュニック 表記 9号 M 相当 紺 ネイビー カットワークレース ボタニカル柄 お出掛け 春 夏 トップス レディース,17050,-853,0,0,美品,レリアン,Leilian,チュニック,表記,9号,M,相当,紺,ネイビー,カットワークレース,ボタニカル柄,お出掛け,春,夏,トップス,レディース,,,,,,
2024/05/05 11:49:16,,美品/ヴィヴィアンタム VIVIENNE TAM カッシュクールワンピース 小さいサイズ 表記1号(7号相当) 黒 メッシュ素材 美彩なお花刺繍 春夏向け,20020,0,910,0,美品,ヴィヴィアンタム,VIVIENNE,TAM,カッシュクールワンピース,小さいサイズ,表記1号(7号相当),黒,メッシュ素材,美彩なお花刺繍,春夏向け,,,,,,,,,,,,
2024/05/05 00:37:10,,新品同様/ビスケー BC ニットカットソー 表記 9号 M 相当 古着 茶 ブラウン レディース 春 夏 トップス 7分袖 薄手 麻混 リネン シンプル,8690,-300,0,600,新品同様,ビスケー,BC,ニットカットソー,表記,9号,M,相当,古着,茶,ブラウン,レディース,春,夏,トップス,7分袖,薄手,麻混,リネン,シンプル,,,
2024/05/04 12:08:38,,美品/ピンキー&amp;ダイアン Pinky&amp;Dianne ジャケット 羽織り 表記 38号 9号 M 相当 ピンク レディース 春 夏 アウター 薄手 シンプル とろみ感,13090,-200,0,0,美品,ピンキー&amp;ダイアン,Pinky&amp;Dianne,ジャケット,羽織り,表記,38号,9号,M,相当,ピンク,レディース,春,夏,アウター,薄手,シンプル,とろみ感,,,,,
2024/05/02 06:44:39,,M新品同様/キャロラインチャールズ CAROLINE CHARLES ジャガード織ジャケット 表記UK14号(11号/L相当) 黒 結婚式 春秋 アウター レディース,24300,0,0,0,M新品同様,キャロラインチャールズ,CAROLINE,CHARLES,ジャガード織ジャケット,表記UK14号(11号,L相当),黒,結婚式,春秋,アウター,レディース,,,,,,,,,,,
2024/04/30 22:11:47,,Ａ美品/ マダムジョコンダ MADAM JOCONDE 大人な美形ニット 表記9号(Mサイズ相当) 黒/ブラック 煌びやかなデザイン 春夏 トップス,5600,0,0,600,Ａ美品,マダムジョコンダ,MADAM,JOCONDE,大人な美形ニット,表記9号(Mサイズ相当),黒,ブラック,煌びやかなデザイン,春夏,トップス,,,,,,,,,,,,
2024/04/29 21:41:28,,美品/レキップ ヨシエイナバ L'EQUIPE YOSHIE INABA プリーツスカート ロング 表記 7号 S 相当 黒 ブラック レディース 春 夏 秋 ボトムス,9790,0,0,600,美品,レキップ,ヨシエイナバ,L'EQUIPE,YOSHIE,INABA,プリーツスカート,ロング,表記,7号,S,相当,黒,ブラック,レディース,春,夏,秋,ボトムス,,,,
2024/04/28 08:41:21,,美品/タルボット TALBOTS カーディガン 羽織り 表記 Ｍ 9号 相当 黒 ブラック レディース 春 夏 秋 トップス 長袖  シンプル ストレッチ,12430,-200,0,0,美品,タルボット,TALBOTS,カーディガン,羽織り,表記,Ｍ,9号,相当,黒,ブラック,レディース,春,夏,秋,トップス,長袖,シンプル,ストレッチ,,,,
2024/04/26 05:22:58,,新品同様/フラジール FRAGILE スカート 小さいサイズ 表記34号 5号 XS相当 シルバーグレー シンプル 薄手 膝丈 春 夏 ボトムス レディース,6270,0,0,600,新品同様,フラジール,FRAGILE,スカート,小さいサイズ,表記34号,5号,XS相当,シルバーグレー,シンプル,薄手,膝丈,春,夏,ボトムス,レディース,,,,,,,
2024/04/25 15:20:50,,新品/アルアバイル allureville マウンテンパーカー 表記2号 9号 M相当 古着 濃紺 ネイビー レディース フード 春 秋 アウター コットン,12980,0,0,0,新品,アルアバイル,allureville,マウンテンパーカー,表記2号,9号,M相当,古着,濃紺,ネイビー,レディース,フード,春,秋,アウター,コットン,,,,,,,
2024/04/24 13:41:28,,新品同様/フィットミーモア Fit me Moi チュニック 大きいサイズ 表記 EL 3L 15号 相当 古着 ピンク レディース 春 夏 トップス 長袖 薄手,9680,0,0,600,新品同様,フィットミーモア,Fit,me,Moi,チュニック,大きいサイズ,表記,EL,3L,15号,相当,古着,ピンク,レディース,春,夏,トップス,長袖,薄手,,,
2024/04/24 07:57:05,,S美【ニナリッチ】マルチカラ*ボタニカル柄*大人スカートスーツ9,6985,-300,0,600,S美【ニナリッチ】マルチカラ*ボタニカル柄*大人スカートスーツ9,,,,,,,,,,,,,,,,,,,,,,
2024/04/23 08:51:49,,美品/チャコット Chacott 社交ダンススカート 表記 Ｍ 9号 相当 赤 レッド レディース ボトムス フリンジ ミモレ丈 ストレッチ ゴム 伸縮,11000,0,0,0,美品,チャコット,Chacott,社交ダンススカート,表記,Ｍ,9号,相当,赤,レッド,レディース,ボトムス,フリンジ,ミモレ丈,ストレッチ,ゴム,伸縮,,,,,,
2024/04/23 08:35:17,,美品/ソニアリキエル SONIA RYKIEL ニット 大きい 表記 46号 13号〜15号 相当白 ホワイト 綿 ハート ビジュー 春 夏 トップス レディース,9350,0,0,600,美品,ソニアリキエル,SONIA,RYKIEL,ニット,大きい,表記,46号,13号〜15号,相当白,ホワイト,綿,ハート,ビジュー,春,夏,トップス,レディース,,,,,
